Game Title,Category,Release Date,Developers,Publishers,Platforms,Genres,Themes,Keywords,YouTube URL,YouTube Views,YouTube Likes,YouTube ReleaseDate,SteamStatus,date_appended
The Legend of Heroes: Trails Beyond the Horizon,Main Game,2026-01-15,Nihon Falcom,"NIS America, Clouded Leopard Entertainment Inc., Nihon Falcom","PlayStation 4, Nintendo Switch 2, PC (Microsoft Windows), PlayStation 5, Nintendo Switch","Role-playing (RPG), Turn-based strategy (TBS), Adventure","Action, Fantasy, Science fiction",,https://www.youtube.com/watch?v=jQELYrJXO-A,47623.0,1555.0,2025-07-24,PC Game (on Steam),
Kejora,Main Game,2026-01-15,Berangin Creative,Berangin Creative,"PC (Microsoft Windows), PlayStation 5, Xbox One, Nintendo Switch","Platform, Puzzle, Adventure, Indie",Action,"hand-drawn, nextfest february 2025",https://www.youtube.com/watch?v=fX6JQYyuFX0,975.0,15.0,2026-01-15,Console / Other,
Ghostly Whiskers,Main Game,2026-01-15,,Nostra Games,"PlayStation 4, PlayStation 5","Puzzle, Adventure",,,No YouTube video found,,,,Console / Other,
Dreamscapes: Nightmare's Heir,Main Game,2026-01-15,,Joindots GmbH,"PlayStation 4, PC (Microsoft Windows), PlayStation 5, Nintendo Switch","Puzzle, Strategy, Adventure, Arcade",Horror,"female protagonist, hidden object, steam, achievements, digital distribution, single-player only, steam cloud, voice acting",No YouTube video found,,,,Console / Other,
BrokenLore: Unfollow,Main Game,2026-01-16,Serafini Productions,"Serafini Productions, Shochiku","Xbox Series X|S, PC (Microsoft Windows), PlayStation 5",Adventure,"Action, Horror, Thriller",,https://www.youtube.com/watch?v=0mWW1YMm2xc,112.0,8.0,2025-12-14,PC Game (on Steam),
Apartment No 129,Main Game,2026-01-16,Latif Güngör,Batuhan Gündüz,"Xbox Series X|S, PC (Microsoft Windows), PlayStation 5","Adventure, Indie","Action, Horror",,https://www.youtube.com/watch?v=qR_Zl2hVLSA,36385.0,1449.0,2025-12-24,Console / Other,
Sumorbit,Main Game,2026-01-18,Jett Williams,,"Xbox Series X|S, PlayStation 4, Linux, PC (Microsoft Windows), PlayStation 5, Mac, Xbox One, Nintendo Switch","Fighting, Puzzle, Indie","Action, Party",,https://www.youtube.com/watch?v=-eYlGgY5tcE,545.0,25.0,2024-10-24,Console / Other,
Bomboban,Main Game,2026-01-19,2dragontails,"2dragontails, y-zo studio","Xbox Series X|S, PlayStation 4, PC (Microsoft Windows), PlayStation 5, Xbox One",Puzzle,,sokoban,https://www.youtube.com/watch?v=hd2I8_lSf4A,15.0,2.0,2026-01-18,Console / Other,
Mio: Memories in Orbit,Main Game,2026-01-20,Douze Dixièmes,Focus Entertainment,"Xbox Series X|S, PlayStation 4, Nintendo Switch 2, PC (Microsoft Windows), PlayStation 5, Xbox One, Nintendo Switch","Platform, Adventure, Indie","Action, Science fiction","metroidvania, androids, nextfest june 2025",https://www.youtube.com/watch?v=cafPCloPgtc,37896.0,702.0,2026-01-20,PC Game (on Steam),
2XKO,Main Game,2026-01-20,Riot Games,Riot Games,"Xbox Series X|S, PC (Microsoft Windows), PlayStation 5",Fighting,Action,,https://www.youtube.com/watch?v=J9YltcB9LyM,75429.0,4064.0,2026-01-06,Non-Steam PC Game,
Warlander,Main Game,2026-01-20,Toylogic,"PLAION, Toylogic","Xbox Series X|S, PC (Microsoft Windows), PlayStation 5","Shooter, Tactical, Hack and slash/Beat 'em up, MOBA","Action, Fantasy, Warfare","medieval, magic, competitive, pvp, swordplay, war, free-to-play, online multiplayer, siege warfare",No YouTube video found,,,,Non-Steam PC Game,
Hextreme Void,Main Game,2026-01-20,Double Mizzlee,Eastasiasoft,"Xbox Series X|S, PlayStation 4, PC (Microsoft Windows), PlayStation 5, Xbox One, Nintendo Switch","Puzzle, Strategy",Action,,No YouTube video found,,,,Non-Steam PC Game,
A House That Glows,Main Game,2026-01-20,Webnetic s. r. o.,Webnetic s. r. o.,"PlayStation 4, PlayStation 5",Visual Novel,,,No YouTube video found,,,,Console / Other,
Anime Uni,Main Game,2026-01-20,BIG WAY,BIG WAY,"PlayStation 4, PlayStation 5, Nintendo Switch",Puzzle,Erotic,,No YouTube video found,,,,Console / Other,
City of Hunger,Main Game,2026-01-21,MVCAO Studios,MVCAO Studios,"SteamVR, PlayStation 5",Shooter,"Action, Horror",zombie shooter,No YouTube video found,,,,Console / Other,
Arknights: Endfield,Main Game,2026-01-22,Hypergryph,Gryphline,"Android, PC (Microsoft Windows), iOS, PlayStation 5","Role-playing (RPG), Strategy, Adventure","Action, Science fiction, Open world","base building, free-to-play, resource gathering, real-time combat, alien world, semi open world",https://www.youtube.com/watch?v=5Xm45NwWOlo,16731779.0,28192.0,2025-12-12,Non-Steam PC Game,
Sega Football Club Champions,Main Game,2026-01-22,Sega,Sega,"PlayStation 4, Android, PC (Microsoft Windows), iOS, PlayStation 5","Simulator, Sport",,"soccer, football, management, cross-platform multiplayer, free-to-play, controller support",https://www.youtube.com/watch?v=biY-hVO7sEE,9739.0,55.0,2025-11-12,PC Game (on Steam),
Mage Wars,Main Game,2026-01-22,Nostra Games,Nostra Games,PlayStation 5,Shooter,Fantasy,voice activated,No YouTube video found,,,,Console / Other,
Stellar Strider,Main Game,2026-01-22,RainForest Games,"y-zo studio, RainForest Games","Xbox Series X|S, PlayStation 4, PlayStation 5",Platform,Kids,,https://www.youtube.com/watch?v=WROE3tip6A4,23.0,2.0,2026-01-21,Console / Other,
Cowboys,Main Game,2026-01-22,Maria,Phoenix Reborn Games,"Xbox Series X|S, PlayStation 4, PC (Microsoft Windows), PlayStation 5, Xbox One",Shooter,Action,,No YouTube video found,,,,Console / Other,
Escape from Ever After,Main Game,2026-01-23,Sleepy Castle Studio,HypeTrain Digital,"Xbox Series X|S, PC (Microsoft Windows), PlayStation 5, Nintendo Switch","Role-playing (RPG), Adventure, Indie",,,https://www.youtube.com/watch?v=koAL6QeFQqc,2001.0,55.0,2025-11-22,PC Game (on Steam),
Ebola Village,Main Game,2026-01-23,indie_games_studio,"indie_games_studio, Axyos Games","PlayStation 4, PC (Microsoft Windows), PlayStation 5, Nintendo Switch","Shooter, Puzzle, Adventure, Indie","Action, Horror, Survival",,https://www.youtube.com/watch?v=VI0HZ-3mo6w,3787.0,29.0,2023-06-11,Console / Other,
Block Cascade,Main Game,2026-01-23,,Webnetic s. r. o.,"PlayStation 4, PlayStation 5",Puzzle,,,No YouTube video found,,,,Console / Other,
Guts 'n Grunts Jr.,Main Game,2026-01-23,Cascadia Games LLC,Cascadia Games LLC,"Xbox Series X|S, PlayStation 4, PC (Microsoft Windows), PlayStation 5, Xbox One, Nintendo Switch",Platform,Action,,No YouTube video found,,,,Non-Steam PC Game,
A Cafe at the End of the World,Main Game,2026-01-23,,,PlayStation 5,Visual Novel,,,No YouTube video found,,,,Console / Other,
Crazy Cats Survivors,Main Game,2026-01-25,,Xeneder Team,"PlayStation 4, PlayStation 5",Shooter,"Action, Fantasy","bullet hell, roguelite",No YouTube video found,,,,Console / Other,
Code Vein II,Main Game,2026-01-26,"Bandai Namco Studios, Shift",Bandai Namco Entertainment,"Xbox Series X|S, PC (Microsoft Windows), PlayStation 5",Role-playing (RPG),Action,"post-apocalyptic, character customization",https://www.youtube.com/watch?v=uF6xLKM-zwg,6236.0,284.0,2026-01-26,PC Game (on Steam),
Highguard,Main Game,2026-01-26,Wildlight Entertainment,Wildlight Entertainment,"Xbox Series X|S, PC (Microsoft Windows), PlayStation 5",Shooter,"Action, Fantasy","accessibility options, subtitles, adjustable text size, custom volume controls, surround sound, stero sound",https://www.youtube.com/watch?v=gqFccBZyTaA,25386.0,418.0,2026-01-26,PC Game (on Steam),
Speedball,Main Game,2026-01-27,Rebellion Developments,Rebellion Developments,"Xbox Series X|S, PC (Microsoft Windows), PlayStation 5","Sport, Arcade",Action,,https://www.youtube.com/watch?v=CiFz0KJS9t8,12127.0,190.0,2024-10-30,PC Game (on Steam),
Ultimate Sheep Raccoon,Main Game,2026-01-27,Clever Endeavour Games,Clever Endeavour Games,"Xbox Series X|S, PlayStation 4, Nintendo Switch 2, PC (Microsoft Windows), PlayStation 5, Xbox One, Nintendo Switch","Racing, Indie","Action, Party",,https://www.youtube.com/watch?v=30uL2cMD_MY,37068.0,1231.0,2025-12-09,Console / Other,
Bus Simulator: World Tour,Main Game,2026-01-27,,,"PlayStation 4, PlayStation 5",Simulator,,,No YouTube video found,,,,Console / Other,
Vironics,Main Game,2026-01-27,Dragon Flame Games,Dragon Flame Games,"PC (Microsoft Windows), PlayStation 5",Shooter,Action,,No YouTube video found,,,,Console / Other,
Dorkomon,Main Game,2026-01-27,EpiXR Games,EpiXR Games,PlayStation 5,"Shooter, Adventure",Action,,No YouTube video found,,,,Console / Other,
Core Keeper: Void & Voltage,Unknown,2026-01-28,Pugstorm,Fireshine Games,"Xbox Series X|S, PlayStation 4, Linux, Nintendo Switch 2, PC (Microsoft Windows), PlayStation 5, Xbox One, Nintendo Switch","Role-playing (RPG), Simulator, Adventure, Indie",Action,"steam cloud, steam families",https://www.youtube.com/watch?v=odARerNhDZU,97504.0,3025.0,2025-11-29,Console / Other,
Dusk Index: Gion,Main Game,2026-01-29,Cherrymochi,Bushiroad Games,"Xbox Series X|S, PC (Microsoft Windows), PlayStation 5, Nintendo Switch","Adventure, Visual Novel","Thriller, Drama",suspense,https://www.youtube.com/watch?v=6T2fifsjRzA,1868.0,52.0,2025-01-14,Console / Other,
Dark Auction,Main Game,2026-01-29,IzanagiGames,"IzanagiGames, Good Smile Company","PC (Microsoft Windows), PlayStation 5, Nintendo Switch",Adventure,Mystery,,No YouTube video found,,,,Console / Other,
I Hate this Place,Main Game,2026-01-29,Rock Square Thunder,"Feardemic, Broken Mirror Games","Xbox Series X|S, PC (Microsoft Windows), PlayStation 5, Nintendo Switch","Shooter, Adventure, Indie","Action, Horror, Survival","crafting, survival horror, steam achievements, xbox controller support for pc, steam cloud, controller support, comicbook style, steam families",https://www.youtube.com/watch?v=cbKJwsJJI4w,2273.0,18.0,2026-01-29,Console / Other,
Kyouran Makaism,Main Game,2026-01-29,Nippon Ichi Software,Nippon Ichi Software,"Nintendo Switch 2, PlayStation 5, Nintendo Switch",Role-playing (RPG),Action,,https://www.youtube.com/watch?v=oq_DQ4hnErQ,34836.0,596.0,2025-11-11,Console / Other,
Cairn,Main Game,2026-01-29,The Game Bakers,The Game Bakers,"Xbox Series X|S, PC (Microsoft Windows), PlayStation 5","Simulator, Adventure, Indie","Action, Survival","climbing, steam cloud, survival mode",https://www.youtube.com/watch?v=6Ejphz8fY0A,416369.0,3770.0,2026-01-29,Console / Other,
Skullbreaker,Main Game,2026-01-29,SharkGame,"Gamesforgames, y-zo studio","PlayStation 4, PC (Microsoft Windows), PlayStation 5","Simulator, Sport, Strategy, Adventure",Action,,https://www.youtube.com/watch?v=BkEn8WA8gXI,11.0,1.0,2026-01-28,Console / Other,
Sovereign Syndicate,Main Game,2026-01-29,Crimson Herring Studios Inc.,Crimson Herring Studios Inc.,"PlayStation 4, PC (Microsoft Windows), PlayStation 5","Point-and-click, Role-playing (RPG)",Mystery,,https://www.youtube.com/watch?v=rbxGKcf8DBw,1435.0,40.0,2023-12-16,Console / Other,
Majotori,Main Game,2026-01-29,Majorariatto,"Majorariatto, Mameshiba Games","PlayStation 4, Linux, Android, PC (Microsoft Windows), iOS, PlayStation 5, Mac, Nintendo Switch","Puzzle, Quiz/Trivia, Adventure, Indie, Arcade","Fantasy, Comedy, Drama, Educational, Party","anime, casual, magic, mature, witches, multiple endings, dark humor, violent",https://www.youtube.com/watch?v=JHlM6kWii1A,64885.0,1116.0,2017-03-28,Console / Other,
67,Main Game,2026-01-29,Oiven Games,Oiven Games,PlayStation 5,,,"brain training, based on - memes",No YouTube video found,,,,Console / Other,
Artifact Seekers,Main Game,2026-01-29,FIVE-BN GAMES,FIVE-BN GAMES,"PC (Microsoft Windows), PlayStation 5, Nintendo Switch","Point-and-click, Adventure",,,No YouTube video found,,,,Console / Other,
Pixel Puzzles Winter Jigsaws,Main Game,2026-01-29,,,"PlayStation 4, PlayStation 5",Puzzle,,,No YouTube video found,,,,Console / Other,
Running Fable Petite Party,Main Game,2026-01-30,Seashell Studio,Seashell Studio,"Xbox Series X|S, PlayStation 4, PC (Microsoft Windows), PlayStation 5, Xbox One, Nintendo Switch","Indie, Arcade, Card & Board Game","Action, Comedy, Kids, Party","minigames, rabbit, cute, cartoon graphics, local multiplayer, dice, easy, turtle, steam achievements, minigame collection, mario party, family, nextfest october 2025",https://www.youtube.com/watch?v=yEVE_UgXJ6Y,13.0,0.0,2025-09-12,Console / Other,
The 9th Charnel,Main Game,2026-01-30,Saikat Deb Creations,SOEDESCO Publishing,"Xbox Series X|S, PC (Microsoft Windows), PlayStation 5","Puzzle, Adventure, Indie","Horror, Survival",lovecraftian,https://www.youtube.com/watch?v=u1AZMoREDAE,205.0,11.0,2025-12-14,Console / Other,
Disco Simulator,Main Game,2026-01-30,"Frozen Cave Studio, Games Incubator","Games Incubator, Ultimate Games S.A., PlayWay S.A.","Xbox Series X|S, PC (Microsoft Windows), PlayStation 5","Simulator, Strategy, Indie",,,https://www.youtube.com/watch?v=j7setoMva1k,166.0,5.0,2026-01-29,Console / Other,
Our Burial Dolls Remastered,Main Game,2026-01-30,,ROSEVERTE,"PlayStation 4, Linux, PC (Microsoft Windows), PlayStation 5, Mac, Nintendo Switch","Role-playing (RPG), Simulator, Adventure, Indie",Horror,,No YouTube video found,,,,Console / Other,
Bumblebee: Search for Happiness,Main Game,2026-01-30,EpiXR Games,EpiXR Games,"PlayStation 5, Xbox One, Nintendo Switch","Simulator, Adventure",Kids,,No YouTube video found,,,,Console / Other,
Avatar Island,Main Game,2026-01-30,,,PlayStation 5,Puzzle,,,No YouTube video found,,,,Console / Other,
Monster Hunter Wilds: Title Update 5,Unknown,2026-02-01,,,"Xbox Series X|S, PC (Microsoft Windows), PlayStation 5",,,,No YouTube video found,,,,Console / Other,
Sanctum Push,Main Game,2026-02-02,2dragontails,"y-zo studio, 2dragontails","Xbox Series X|S, PlayStation 4, PC (Microsoft Windows), PlayStation 5, Xbox One",Puzzle,,sokoban,https://www.youtube.com/watch?v=ZaQ660hS230,16.0,2.0,2026-02-01,Console / Other,
Dragon Quest VII: Reimagined - Digital Deluxe Edition,Main Game,2026-02-03,"HexaDrive, Square Enix Creative Studio 5",Square Enix,"Xbox Series X|S, Nintendo Switch 2, PC (Microsoft Windows), PlayStation 5, Nintendo Switch","Role-playing (RPG), Adventure",Fantasy,,No YouTube video found,,,,Console / Other,
Aces of Thunder,Main Game,2026-02-03,Gaijin Entertainment,Gaijin Entertainment,"PlayStation VR2, PC (Microsoft Windows), SteamVR, PlayStation 5",Simulator,"Action, Non-fiction, Warfare","world war ii - ww2, airplane combat, vr experience",https://www.youtube.com/watch?v=brbpCEupa6w,39336.0,2075.0,2026-02-03,Console / Other,
Hidden Cats in Christmas,Main Game,2026-02-04,Nukearts,Nukearts,"PlayStation 4, PC (Microsoft Windows), PlayStation 5, Nintendo Switch","Point-and-click, Puzzle, Adventure, Indie, Card & Board Game",,hidden object,No YouTube video found,,,,Console / Other,
Prison Escape Simulator: Dig Out,Main Game,2026-02-04,Digital Melody,PlayWay S.A.,"PC (Microsoft Windows), PlayStation 5, Mac","Simulator, Adventure, Indie",Action,"helicopter, life simulation, basketball, cars, 3d, physics, police, voxel, resource management, slot machine, exercise, gambling, driving, management, trading, achievements, time limit, upgrade, crime, drifting, climbing, realistic, day/night cycle, inventory management, upgradable equipment, navigation, time management, explosion, steam achievements, timer, xbox controller support for pc, dualshock 4 support for pc, explosives, resource gathering, vending machine interaction, invisible wall, sleeping, escaping imprisonment, negotiation, soft reset, controller support, vehicles, roguelite, escape game, islands, underground, ai-generated artwork, food, bombs, coins, decorate, digging, buy and sell, lighthouse, sewer, immersive sim, dirt, steam families, money, imprisoned, time, dualsense support for pc, quest, upgrades, letters, decorating, explosive, cave, stamina, prison",https://www.youtube.com/watch?v=4f0-zHQbedE,358.0,13.0,2026-02-02,Console / Other,
Lovish,Main Game,2026-02-05,LABS Works,DANGEN Entertainment,"Xbox Series X|S, PlayStation 4, PC (Microsoft Windows), PlayStation 5, Nintendo Switch","Platform, Role-playing (RPG), Hack and slash/Beat 'em up, Adventure, Indie, Arcade",Action,"retro, 2d, funny, pixel art, love story, 2d animation, steam achievements, cartoon cutscene",https://www.youtube.com/watch?v=bJfogOqxJAE,19453.0,750.0,2024-11-21,Console / Other,
Hollow Knight,Main Game,2026-02-05,Team Cherry,Team Cherry,"Xbox Series X|S, PlayStation 4, Linux, Nintendo Switch 2, PC (Microsoft Windows), PlayStation 5, Mac, Wii U, Xbox One, Nintendo Switch","Platform, Adventure, Indie","Action, Fantasy","dark, sword, skill-based, 2d, metroidvania, insects, action-adventure, steam, achievements, steam trading cards, explorable world, atmospheric, giant insects, silent protagonist, crowdfunding - kickstarter, hand-drawn, crowdfunding, 2d platformer, boss fight, steam achievements, xbox controller support for pc, controller recommendation, crowd funded, shielded enemies, parrying, merchants, fast traveling, creature compendium, the game awards 2017, best debut indie game: nominee - 2017 (the game awards), the game awards - nominee, controller support, the game awards - best debut indie game - nominee, interconnected-world, armed bugs, money, shop keeper, sidescroller, available on - luna plus, available on - luna gog",https://www.youtube.com/watch?v=0lp2IG35Yho,226114.0,8400.0,2026-02-05,Console / Other,
My Hero Academia: All's Justice,Main Game,2026-02-05,Byking Inc.,Bandai Namco Entertainment,"Xbox Series X|S, PC (Microsoft Windows), PlayStation 5",Fighting,"Action, Science fiction",,https://www.youtube.com/watch?v=yXotYKenTSQ,22220.0,918.0,2025-08-21,Console / Other,
Wuthering Waves: For You Who Walk in Snow,Unknown,2026-02-05,Kuro Games,Kuro Games,"Android, PC (Microsoft Windows), iOS, PlayStation 5, Mac","Role-playing (RPG), Adventure","Action, Fantasy, Science fiction, Open world",,https://www.youtube.com/watch?v=6lpiSBvawB0,2670079.0,16783.0,2026-01-23,Console / Other,
Nioh 3,Main Game,2026-02-06,Team NINJA,Koei Tecmo Games,"PC (Microsoft Windows), PlayStation 5","Role-playing (RPG), Adventure",Action,,https://www.youtube.com/watch?v=rDyuGUlmTcY,908548.0,29.0,2026-02-06,PC Game (on Steam),
JDM: Japanese Drift Master,Main Game,2026-02-06,Gaming Factory,"Gaming Factory, 4Divinity","Xbox Series X|S, PC (Microsoft Windows), PlayStation 5","Racing, Simulator, Sport, Adventure, Arcade",,,https://www.youtube.com/watch?v=hWTgzh9k0b0,16926.0,425.0,2026-01-08,Console / Other,
Carmageddon: Rogue Shift,Main Game,2026-02-06,34BigThings,34BigThings,"Xbox Series X|S, Nintendo Switch 2, PC (Microsoft Windows), PlayStation 5",Racing,Action,,https://www.youtube.com/watch?v=1y65d1Flw0I,1605364.0,1213.0,2026-02-05,Console / Other,
Zenless Zone Zero: Update 2.6 - Encore for an Old Dream,Unknown,2026-02-06,"HoYoverse, Cognosphere","HoYoverse, Cognosphere","Xbox Series X|S, Android, PC (Microsoft Windows), iOS, PlayStation 5","Role-playing (RPG), Hack and slash/Beat 'em up, Adventure",Action,,https://www.youtube.com/watch?v=pMchTj9qzQY,175826.0,11928.0,2026-01-30,Console / Other,
Mote: Workshop,Main Game,2026-02-06,CraePlay,GGmuks Inc.,"PlayStation 5, PlayStation",Simulator,,walking simulator,No YouTube video found,,,,Console / Other,
Giant Chase,Main Game,2026-02-06,,Entity3 Limited,"PlayStation 5, Nintendo Switch","Adventure, Arcade",Action,,No YouTube video found,,,,Console / Other,
Sora: Winds of the Jungle,Main Game,2026-02-06,,EpiXR Games,"PlayStation 5, Nintendo Switch","Racing, Simulator, Adventure",,,No YouTube video found,,,,Console / Other,
Where Winds Meet: Spring's Bliss,Unknown,2026-02-06,Everstone Studio,NetEase Games,"Android, PC (Microsoft Windows), iOS, PlayStation 5",,,"martial arts, wuxia",https://www.youtube.com/watch?v=p4582Cijc0o,11038.0,1071.0,2026-02-05,Console / Other,
Dot Net,Main Game,2026-02-06,Acyntha,Acyntha,"PlayStation 4, PlayStation 5",,,,No YouTube video found,,,,Console / Other,
Kuky Adventure,Main Game,2026-02-09,Magnific Studios,"Magnific Studios, y-zo studio","Xbox Series X|S, PlayStation 4, PC (Microsoft Windows), PlayStation 5, Xbox One","Platform, Adventure",Action,,https://www.youtube.com/watch?v=N3636e6jcdI,106.0,3.0,2026-02-08,Console / Other,
Ultra Super Reflection Guide,Main Game,2026-02-09,,Xitilon,"PlayStation 4, PlayStation 5",Arcade,,,No YouTube video found,,,,Console / Other,
Ship's Cat,Main Game,2026-02-09,Caddy Computing,Caddy Computing,"PC (Microsoft Windows), PlayStation 5","Platform, Adventure, Indie","Action, Comedy",,https://www.youtube.com/watch?v=XZbFmmomvkg,801.0,11.0,2023-12-08,Console / Other,
Pixel Puzzles Japan Jigsaws,Main Game,2026-02-09,,,"PlayStation 4, PlayStation 5",Puzzle,,,No YouTube video found,,,,Console / Other,
Anime Uni 7: A Happy Valentine,Main Game,2026-02-09,BIG WAY,BIG WAY,"PlayStation 4, PlayStation 5",Puzzle,,,No YouTube video found,,,,Console / Other,
Crisol: Theater of Idols,Main Game,2026-02-10,Vermila Studios,Blumhouse Games,"Xbox Series X|S, PC (Microsoft Windows), PlayStation 5","Shooter, Adventure","Action, Horror, Survival, Mystery","dystopian, atmospheric",https://www.youtube.com/watch?v=ojViCqVTjsc,4069.0,118.0,2026-02-10,Console / Other,
Helldivers 2: Machinery of Oppression,Unknown,2026-02-10,Arrowhead Game Studios,Sony Interactive Entertainment,"Xbox Series X|S, PC (Microsoft Windows), PlayStation 5","Shooter, Tactical","Action, Science fiction",,https://www.youtube.com/watch?v=xzxwfxpPPS8,87480.0,3404.0,2026-02-10,Console / Other,
Romeo is a Dead Man,Main Game,2026-02-11,Grasshopper Manufacture,Grasshopper Manufacture,"Xbox Series X|S, PC (Microsoft Windows), PlayStation 5","Shooter, Hack and slash/Beat 'em up, Adventure","Action, Science fiction, Comedy, Mystery","bloody, surrealism, time travel, action-adventure, gore, surreal, dark humor, resurrection, time paradox, multiverse, stylish action, half-dead",https://www.youtube.com/watch?v=CHcb7_MEDKQ,30252.0,2312.0,2026-02-09,Console / Other,
No Man's Sky: Remnant,Unknown,2026-02-11,,,"Xbox Series X|S, PlayStation 4, Nintendo Switch 2, PC (Microsoft Windows), PlayStation 5, Mac, Xbox One, Nintendo Switch",,,,https://www.youtube.com/watch?v=IXWYo58yiz4,527765.0,36482.0,2026-02-11,Console / Other,
Cash Cleaner Simulator,Main Game,2026-02-11,Mind Control,Forklift Interactive,"Xbox Series X|S, PC (Microsoft Windows), PlayStation 5","Simulator, Indie",,,https://www.youtube.com/watch?v=EbP8pJA3BBM,21057.0,14.0,2025-05-08,Console / Other,
Dark Ties,Main Game,2026-02-12,Ryu Ga Gotoku Studios,Sega,"Xbox Series X|S, PlayStation 4, Nintendo Switch 2, PC (Microsoft Windows), PlayStation 5",,,,https://www.youtube.com/watch?v=za9rjoTdG_M,463013.0,19417.0,2025-09-24,Console / Other,
ChromaGun 2: Dye Hard,Main Game,2026-02-12,Pixel Maniacs,PM Studios,"Xbox Series X|S, Nintendo Switch 2, PC (Microsoft Windows), PlayStation 5","Shooter, Puzzle, Strategy, Adventure, Indie","Action, Science fiction, Comedy","action-adventure, steam, steam achievements, steam cloud",https://www.youtube.com/watch?v=f2Hey9REICI,551.0,13.0,2026-02-12,Console / Other,
Ride 6,Main Game,2026-02-12,Milestone,Milestone,"Xbox Series X|S, PC (Microsoft Windows), PlayStation 5","Racing, Simulator, Sport",,"racing sim, motorsports",https://www.youtube.com/watch?v=sqEVNUNA9Ng,50078.0,192.0,2026-02-12,Console / Other,
Heart of the Forest,Main Game,2026-02-12,"Trapped Predator, Wales Interactive",Wales Interactive,"Xbox Series X|S, PlayStation 4, Android, PC (Microsoft Windows), iOS, PlayStation 5, Mac, Xbox One, Nintendo Switch","Adventure, Indie, Visual Novel",Horror,"steam achievements, fmv",https://www.youtube.com/watch?v=LVfKbhzbUmA,12015.0,109.0,2025-09-30,Console / Other,
Pure Pool Pro,Main Game,2026-02-12,Rockwater Games,Ripstone,"Xbox Series X|S, PC (Microsoft Windows), PlayStation 5","Simulator, Sport, Strategy, Indie",,"pool, billiards, relaxing, billiards game, jazz, cosy",https://www.youtube.com/watch?v=oCLc4qrR1u0,5186.0,100.0,2026-02-05,Console / Other,
Yakuza Kiwami 3 & Dark Ties: Deluxe Edition,Main Game,2026-02-12,Ryu Ga Gotoku Studios,Sega,"Xbox Series X|S, PlayStation 4, Nintendo Switch 2, PC (Microsoft Windows), PlayStation 5","Role-playing (RPG), Adventure",Action,,No YouTube video found,,,,Console / Other,
God of War Sons of Sparta,Main Game,2026-02-12,Mega Cat Studios,Sony Interactive Entertainment,PlayStation 5,"Platform, Adventure","Action, Fantasy","greek mythology, prequel, metroidvania, kratos",https://www.youtube.com/watch?v=eFhOo6NTt70,1685145.0,63385.0,2026-02-12,Console / Other,
Disciples: Domination,Main Game,2026-02-12,Artefacts Studio,Kalypso Media,"Xbox Series X|S, PC (Microsoft Windows), PlayStation 5, Mac","Role-playing (RPG), Strategy",Fantasy,,https://www.youtube.com/watch?v=qibYooMRqsg,2671.0,53.0,2026-02-12,Console / Other,
Centipede Gun,Main Game,2026-02-12,Mateusk2m,QUByte Interactive,"Xbox Series X|S, PlayStation 4, PC (Microsoft Windows), PlayStation 5, Xbox One, Nintendo Switch","Shooter, Strategy, Indie, Arcade",Action,roguelike,https://www.youtube.com/watch?v=TsLwt2RM19Q,674.0,28.0,2026-01-22,Console / Other,
High on Life 2,Main Game,2026-02-13,Squanch Games,Squanch Games,"Xbox Series X|S, Nintendo Switch 2, PC (Microsoft Windows), PlayStation 5","Shooter, Adventure","Action, Science fiction, Comedy",,https://www.youtube.com/watch?v=PdMX5_snGGQ,39532.0,1251.0,2026-02-13,Console / Other,
Reanimal,Main Game,2026-02-13,Tarsier Studios,THQ Nordic,"Xbox Series X|S, Nintendo Switch 2, PC (Microsoft Windows), PlayStation 5","Puzzle, Adventure","Action, Horror",nextfest october 2025,https://www.youtube.com/watch?v=5_EfcYKD65g,2082804.0,760.0,2026-02-13,PC Game (on Steam),
Reanimal: Collector's Edition,Main Game,2026-02-13,Tarsier Studios,THQ Nordic,"Xbox Series X|S, Nintendo Switch 2, PC (Microsoft Windows), PlayStation 5",Adventure,Horror,,https://www.youtube.com/watch?v=17WtFn0P2eM,34966.0,1185.0,2025-08-01,Console / Other,
Reanimal: Digital Deluxe Edition,Main Game,2026-02-13,Tarsier Studios,THQ Nordic,"Xbox Series X|S, Nintendo Switch 2, PC (Microsoft Windows), PlayStation 5",Adventure,Horror,,No YouTube video found,,,,Console / Other,
