Game Title,Category,Release Date,1,Publishers,Platforms,Genres,Themes,Keywords,YouTube URL,YouTube Views,YouTube Likes,YouTube ReleaseDate,SteamStatus,Unnamed: 14
Aerial_Knight's DropShot,Main Game,17/2/2026,Aerial_Knight,Aerial_Knight,"Xbox Series X|S, PC (Microsoft Windows), PlayStation 5","Shooter, Racing, Simulator, Strategy, Indie, Arcade",Action,arcade shooter,https://www.youtube.com/watch?v=akOVT_R3QXY,5314,35,14/1/2026,PC Game (on Steam),11/3/2026
Plane Flight Simulator,Main Game,17/2/2026,,Christopher Ikeda,PlayStation 5,"Simulator, Adventure",,airplane,No YouTube video found,,,,Console / Other,11/3/2026
Vampire Therapist,Main Game,17/2/2026,Little Bat Games,"Little Bat Games, Ultimate Games","Xbox Series X|S, PlayStation 4, Linux, PC (Microsoft Windows), PlayStation 5, Mac, Xbox One, Nintendo Switch","Simulator, Adventure, Indie, Visual Novel","Horror, Comedy, Drama","gothic, demo, psychological, vampires, free demo, dark comedy",https://www.youtube.com/watch?v=ZwFHm1czhrk,201,20,11/6/2024,Console / Other,11/3/2026
Under the Island,Main Game,17/2/2026,Slime King Games,Top Hat Studios,"Xbox Series X|S, PlayStation 4, PC (Microsoft Windows), PlayStation 5, Nintendo Switch","Puzzle, Role-playing (RPG), Adventure, Indie",Action,"exploration, 2d, female protagonist, explorable world, day/night cycle, dungeon, action-rpg",https://www.youtube.com/watch?v=xGT63IjWyqE,30900,69,17/2/2026,PC Game (on Steam),11/3/2026
Star Trek: Voyager - Across the Unknown,Main Game,18/2/2026,Gamexcite,Daedalic Entertainment,"Xbox Series X|S, Nintendo Switch 2, PC (Microsoft Windows), PlayStation 5","Strategy, Indie",Science fiction,"interactive fiction, story driven, space, steam achievements, xbox controller support for pc, steam cloud, controller support, steam families, spaceships",https://www.youtube.com/watch?v=sWGsMGOziqM,1015866,295,18/2/2026,PC Game (on Steam),11/3/2026
Styx: Blades of Greed,Main Game,19/2/2026,Cyanide Studio,Nacon,"Xbox Series X|S, PC (Microsoft Windows), PlayStation 5",Adventure,"Action, Fantasy, Stealth",dark fantasy,https://www.youtube.com/watch?v=S757dD5mX_Y,666,60,9/3/2026,PC Game (on Steam),11/3/2026
Death Match Love Comedy!,Main Game,19/2/2026,Kemco,"PQube, Kemco","Xbox Series X|S, PlayStation 4, Android, PC (Microsoft Windows), iOS, PlayStation 5, Wii U, Nintendo Switch","Adventure, Visual Novel","Fantasy, Comedy, Romance","high school, dating simulation",https://www.youtube.com/watch?v=4uHg3yAyxnY,2549,77,11/12/2024,PC Game (on Steam),11/3/2026
Death Howl,Main Game,19/2/2026,The Outer Zone,11 bit studios,"Xbox Series X|S, PC (Microsoft Windows), PlayStation 5, Nintendo Switch","Strategy, Turn-based strategy (TBS), Tactical, Adventure, Indie, Card & Board Game",Fantasy,"soulslike, deck-building, deckbuilder",https://www.youtube.com/watch?v=9Jonqy6BS9A,89009,157,8/12/2025,Console / Other,11/3/2026
Showgunners,Main Game,19/2/2026,Artificer,"Good Shepherd Entertainment, Devolver Digital, Klabater","Xbox Series X|S, PlayStation 4, PC (Microsoft Windows), PlayStation 5, Xbox One","Strategy, Turn-based strategy (TBS), Tactical",Science fiction,cyberpunk,https://www.youtube.com/watch?v=B23nVz1TndU,21616,715,9/12/2025,Console / Other,11/3/2026
Kletka,Main Game,19/2/2026,"Callback, ln404","Callback, ln404","Xbox Series X|S, PlayStation 4, Linux, PC (Microsoft Windows), PlayStation 5, Xbox One, Nintendo Switch","Adventure, Indie","Action, Horror",,https://www.youtube.com/watch?v=DQ_UF9X1-wE,56276,3881,19/2/2026,PC Game (on Steam),11/3/2026
Love Eternal,Main Game,19/2/2026,brlka,Ysbryd Games,"Xbox Series X|S, PlayStation 4, PC (Microsoft Windows), PlayStation 5, Xbox One, Nintendo Switch","Platform, Adventure, Indie",Horror,"dark, female protagonist, side-scrolling, precision platforming",https://www.youtube.com/watch?v=Ji3RdO-OhYM,4151,80,20/1/2026,PC Game (on Steam),11/3/2026
Soulslinger: Envoy of Death,Main Game,19/2/2026,Elder Games,Headup Publishing,"Xbox Series X|S, PC (Microsoft Windows), PlayStation 5","Shooter, Adventure, Indie","Action, Fantasy",,https://www.youtube.com/watch?v=95Yz9Uvrh7U,1354,31,25/3/2025,Console / Other,11/3/2026
Backrooms Level X,Main Game,19/2/2026,,Firenut Games,"Xbox Series X|S, PC (Microsoft Windows), PlayStation 5, Nintendo Switch","Adventure, Indie","Action, Horror, Survival","psychological horror, steam achievements, backrooms, steam families",https://www.youtube.com/watch?v=1bYZFSZ0UXc,65,3,30/9/2025,Console / Other,11/3/2026
Manairons,Main Game,19/2/2026,JanduSoft,JanduSoft,"Xbox Series X|S, PC (Microsoft Windows), PlayStation 5, Nintendo Switch","Platform, Hack and slash/Beat 'em up, Adventure, Indie","Action, Fantasy","exploration, 3d platformer, family friendly, action platformer, fantasy world",https://www.youtube.com/watch?v=zQQGMym3HLI,6417,44,24/9/2025,PC Game (on Steam),11/3/2026
The Stairwell,Main Game,19/2/2026,Hidden Palace,,"PC (Microsoft Windows), PlayStation 5","Puzzle, Simulator, Indie","Horror, Mystery","anomaly, anomaly hunt",https://www.youtube.com/watch?v=SElBQSlppB4,89153,2885,12/2/2026,Console / Other,11/3/2026
BMX Streets,Main Game,19/2/2026,Mash Games,,"Xbox Series X|S, PC (Microsoft Windows), PlayStation 5","Simulator, Sport",Action,"bmx, stunts, controller required",https://www.youtube.com/watch?v=Q_c6XMMKTS4,67878,1978,22/3/2024,Console / Other,11/3/2026
Outpath,Main Game,19/2/2026,David Moralejo Sánchez,"GrabTheGames, Silver Lining Interactive","Xbox Series X|S, PlayStation 4, PC (Microsoft Windows), PlayStation 5, Nintendo Switch","Simulator, Strategy, Adventure, Indie","Action, Survival, Sandbox, Open world",building,https://www.youtube.com/watch?v=hYcIPBJbhZE,215,12,19/2/2026,Console / Other,11/3/2026
Amer: The Chase Hit and Run,Main Game,19/2/2026,Mad Hook,Mad Hook,"PlayStation 4, Android, PC (Microsoft Windows), iOS, PlayStation 5","Racing, Adventure","Kids, Open world",,No YouTube video found,,,,Console / Other,11/3/2026
Baladins,Main Game,20/2/2026,Seed by Seed,Seed by Seed,"PlayStation 4, PC (Microsoft Windows), PlayStation 5, Nintendo Switch","Role-playing (RPG), Adventure, Card & Board Game",Fantasy,"medieval, interactive fiction, choose your own adventure, party-based, story rich, hand-drawn",https://www.youtube.com/watch?v=woaoVQTXOaw,4718,72,24/4/2024,Console / Other,11/3/2026
Mortanis Prisoners,Main Game,20/2/2026,,,"Xbox Series X|S, PC (Microsoft Windows), PlayStation 5","Adventure, Indie",Action,,https://www.youtube.com/watch?v=wa3hZGYKEjM,61,0,10/2/2026,Console / Other,11/3/2026
Glint's Revenge,Main Game,20/2/2026,CraePlay,GGmuks Inc.,"PlayStation 4, PlayStation 5","Shooter, Platform",Action,,No YouTube video found,,,,Console / Other,11/3/2026
"Loaders, Inc.",Main Game,20/2/2026,OSA Studio,Appwill Сompany,"PlayStation 4, PlayStation 5, Nintendo Switch","Simulator, Strategy, Arcade",,,No YouTube video found,,,,Console / Other,11/3/2026
Super Hoops 2,Main Game,20/2/2026,,Entity3 Limited,"PlayStation 5, Nintendo Switch","Platform, Sport, Arcade",Action,,No YouTube video found,,,,Console / Other,11/3/2026
The House of the Dead 2: Remake - Infect Edition,Main Game,20/2/2026,MegaPixel Studio S.A.,Forever Entertainment S.A.,"Xbox Series X|S, PlayStation 5, Nintendo Switch","Shooter, Arcade","Action, Horror, Survival",,No YouTube video found,,,,Console / Other,11/3/2026
Slither Realm,Main Game,23/2/2026,"KazakovStudios, SharkGame","KazakovStudios, y-zo studio","PlayStation 4, PC (Microsoft Windows), PlayStation 5",Puzzle,,,https://www.youtube.com/watch?v=MvlTjDNj5P4,5,3,22/2/2026,Console / Other,11/3/2026
Bread & Fred,Main Game,24/2/2026,SandCastles Studio,"SandCastles Studio, Apogee Entertainment","Xbox Series X|S, PlayStation 4, PC (Microsoft Windows), PlayStation 5, Mac, Xbox One, Nintendo Switch","Platform, Indie","Action, Party","physics, 2d, difficult, side-scrolling, controller support",https://www.youtube.com/watch?v=MM09k_NgkeA,111291,3530,23/5/2024,Console / Other,11/3/2026
G Press,Main Game,24/2/2026,Xitilon,Xitilon,"PlayStation 4, PlayStation 5",Arcade,,,No YouTube video found,,,,Console / Other,11/3/2026
"Genshin Impact: Homeward, He Who Caught the Wind",Unknown,25/2/2026,"Cognosphere, HoYoverse","Cognosphere, HoYoverse","Xbox Series X|S, PlayStation 4, Android, PC (Microsoft Windows), iOS, PlayStation 5","Role-playing (RPG), Adventure","Action, Fantasy, Open world",,https://www.youtube.com/watch?v=OBH8AB80DDM,110378,3860,13/2/2026,Non-Steam PC Game,11/3/2026
No Sleep for Kaname Date: From AI - The Somnium Files,Main Game,26/2/2026,Spike Chunsoft,"Spike Chunsoft, Reef Entertainment","PlayStation 4, Nintendo Switch 2, PC (Microsoft Windows), PlayStation 5, Nintendo Switch","Puzzle, Adventure, Visual Novel","Science fiction, Thriller","anime, detective, artificial intelligence, dreams, escape game",https://www.youtube.com/watch?v=LmC5eYNiUrI,19372,657,11/11/2025,Console / Other,11/3/2026
Tokyo Xtreme Racer,Main Game,26/2/2026,Genki Co. Ltd.,Genki Co. Ltd.,"PC (Microsoft Windows), PlayStation 5",Racing,Action,"street racing, japan, upgradeable vehicles, sports cars, tokyo, highways, car racing",https://www.youtube.com/watch?v=umlztIQ7HeE,147974,5023,4/12/2024,Console / Other,11/3/2026
Towerborne,Main Game,26/2/2026,Stoic,Xbox Game Studios,"Xbox Series X|S, PC (Microsoft Windows), PlayStation 5","Role-playing (RPG), Adventure",Action,,https://www.youtube.com/watch?v=7bY1Hgia6_I,24255,934,26/2/2026,PC Game (on Steam),11/3/2026
Towerborne: Deluxe Edition,Main Game,26/2/2026,Stoic,Xbox Game Studios,"Xbox Series X|S, PC (Microsoft Windows), PlayStation 5","Role-playing (RPG), Adventure",Action,,No YouTube video found,,,,Non-Steam PC Game,11/3/2026
Monkaru Fanta: Yuusha to Suishou no Shoujo,Main Game,26/2/2026,Experience Inc.,Experience Inc.,"PC (Microsoft Windows), PlayStation 5, Nintendo Switch",Role-playing (RPG),Fantasy,jrpg,No YouTube video found,,,,Non-Steam PC Game,11/3/2026
PC Building Simulator 2,Main Game,26/2/2026,Spiral House,Epic Games Publishing,"Xbox Series X|S, PC (Microsoft Windows), PlayStation 5",Simulator,Business,building,https://www.youtube.com/watch?v=4qV3VtS00u8,3005,50,16/2/2026,Console / Other,11/3/2026
Daimon Guardian,Main Game,26/2/2026,Hyperreality Entertainment,y-zo studio,"PlayStation 4, PlayStation 5",,,,No YouTube video found,,,,Console / Other,11/3/2026
Shadow Corridor 2: Ame no Yohira,Main Game,26/2/2026,Space Onigiri Games,,"PC (Microsoft Windows), PlayStation 5, Nintendo Switch","Strategy, Adventure, Indie","Action, Horror",,https://www.youtube.com/watch?v=J_On_ZEJn8o,989,6,19/2/2026,Console / Other,11/3/2026
Sands of Aura,Main Game,26/2/2026,Chashu Entertainment,Freedom Games,"Xbox Series X|S, PC (Microsoft Windows), PlayStation 5, Nintendo Switch","Role-playing (RPG), Adventure, Indie","Action, Fantasy","dungeon crawler, soulslike",https://www.youtube.com/watch?v=Vg8knVQ4AMo,11611,191,26/2/2026,Console / Other,11/3/2026
Daisenryaku SSB2,Main Game,26/2/2026,SystemSoft Beta,SystemSoft Beta,"Nintendo Switch 2, PC (Microsoft Windows), PlayStation 5, Nintendo Switch","Simulator, Strategy",,,https://www.youtube.com/watch?v=vPcZjKVzMho,77113,619,19/9/2025,Non-Steam PC Game,11/3/2026
Crazy Basket,Main Game,26/2/2026,GGmuks Inc.,GGmuks Inc.,"PlayStation 4, PlayStation 5",Sport,,,No YouTube video found,,,,Console / Other,11/3/2026
Resident Evil Requiem,Main Game,27/2/2026,Capcom Development Division 1,Capcom,"Xbox Series X|S, Nintendo Switch 2, PC (Microsoft Windows), PlayStation 5","Shooter, Puzzle, Adventure","Action, Horror, Survival","zombies, exploration, crafting, resource management, shooting, backtracking, survival horror, inventory management, violent, boss fight, upgradeable weapons, jump scare moment, suspense, survival shooter",https://www.youtube.com/watch?v=9lrThxCoznw,450446,11009,27/2/2026,Console / Other,11/3/2026
Laysara: Summit Kingdom,Main Game,27/2/2026,Quite OK Games,"Quite OK Games, Future Friends Games","Xbox Series X|S, PlayStation 4, PC (Microsoft Windows), PlayStation 5, Xbox One, Nintendo Switch","Puzzle, Simulator, Strategy, Indie","Survival, Sandbox","resource management, steam trading cards, base management, demo, city builder, steam achievements, steam cloud, settlement building, free demo, steam families",https://www.youtube.com/watch?v=yMTNnNyCNx4,2994,31,27/2/2026,Console / Other,11/3/2026
Tales of Berseria Remastered: Deluxe Edition,Main Game,27/2/2026,D.A.G Inc.,Bandai Namco Entertainment,"Xbox Series X|S, PC (Microsoft Windows), PlayStation 5, Nintendo Switch",Role-playing (RPG),"Action, Fantasy, Open world",,No YouTube video found,,,,Console / Other,11/3/2026
Warplanes: WW2 Dogfight,Main Game,27/2/2026,Home Net Games,"Home Net Games, 7levels","Linux, Android, PC (Microsoft Windows), iOS, PlayStation 5, Mac, Nintendo Switch","Shooter, Simulator, Indie",Action,,https://www.youtube.com/watch?v=VCKBzUg1pac,731,11,13/2/2026,Console / Other,11/3/2026
Resident Evil Requiem: Lenticular Edition,Main Game,27/2/2026,Capcom Development Division 1,Capcom,"Xbox Series X|S, Nintendo Switch 2, PlayStation 5","Shooter, Puzzle, Adventure","Action, Horror, Survival",,No YouTube video found,,,,Console / Other,11/3/2026
Emoji Battlefield: Island Warfare,Main Game,27/2/2026,EpiXR Games,EpiXR Games,"PlayStation 5, Nintendo Switch",Arcade,Action,,No YouTube video found,,,,Console / Other,11/3/2026
Dimensional Animals,Main Game,28/2/2026,Marcos Game Dev,"Marcos Game Dev, Eastasiasoft","Xbox Series X|S, PlayStation 4, PC (Microsoft Windows), PlayStation 5, Xbox One, Nintendo Switch","Adventure, Indie",Action,"demo, free demo",https://www.youtube.com/watch?v=hCjPSNKkJYI,1781,136,19/6/2023,Console / Other,11/3/2026
Snoot Runner,Main Game,28/2/2026,,,"PlayStation 4, Linux, PC (Microsoft Windows), PlayStation 5",Adventure,Action,,No YouTube video found,,,,Console / Other,11/3/2026
Sand: Raiders Of Sophie,Main Game,1/3/2026,"Hologryph, TowerHaus",tinyBuild,"Xbox Series X|S, PC (Microsoft Windows), PlayStation 5",Adventure,"Action, Historical",pvpve,https://www.youtube.com/watch?v=H-Q9LKOOnvg,8250,139,8/1/2026,Console / Other,11/3/2026
Froggy Hates Snow,Main Game,1/3/2026,,,"Xbox Series X|S, PlayStation 4, PC (Microsoft Windows), PlayStation 5","Strategy, Indie",Action,,https://www.youtube.com/watch?v=bXNAWYvsiuQ,21,2,22/2/2026,Console / Other,11/3/2026
Dual Paths,Main Game,2/3/2026,Yume Game Studio,"Yume Game Studio, y-zo studio","Xbox Series X|S, PlayStation 4, PC (Microsoft Windows), PlayStation 5, Xbox One",Platform,,,https://www.youtube.com/watch?v=2jqqdvhcQq4,31,3,1/3/2026,Console / Other,11/3/2026
Scott Pilgrim EX,Main Game,3/3/2026,Tribute Games,Tribute Games,"Xbox Series X|S, PlayStation 4, Linux, Nintendo Switch 2, PC (Microsoft Windows), PlayStation 5, Nintendo Switch",Adventure,Action,nextfest february 2026,https://www.youtube.com/watch?v=iV1izGXgJFQ,32144,1120,28/1/2026,Console / Other,11/3/2026
Minishoot' Adventures,Main Game,3/3/2026,SoulGame Studio,SoulGame Studio,"Xbox Series X|S, Nintendo Switch 2, PC (Microsoft Windows), PlayStation 5, Xbox One, Nintendo Switch","Shooter, Role-playing (RPG), Adventure, Indie",Action,,https://www.youtube.com/watch?v=sObVVSmesZ8,9078,131,3/3/2026,Console / Other,11/3/2026
Ebaseball: Pro Spirit,Main Game,4/3/2026,Konami,Konami,"PC (Microsoft Windows), PlayStation 5",Sport,"Action, Non-fiction","baseball, free-to-play, ai-generated voices",https://www.youtube.com/watch?v=WwG3ffyx7-Y,36751,333,5/3/2026,Console / Other,11/3/2026
Shrink Rooms,Main Game,4/3/2026,,,"PC (Microsoft Windows), PlayStation 5, Nintendo Switch","Platform, Puzzle, Strategy, Indie",Action,,https://www.youtube.com/watch?v=Q4Ep9FT8Ooc,963,2,20/2/2025,Console / Other,11/3/2026
Never Grave: The Witch and the Curse,Main Game,5/3/2026,Frontside 180,PocketPair,"Xbox Series X|S, PlayStation 4, PC (Microsoft Windows), PlayStation 5, Nintendo Switch","Platform, Puzzle, Hack and slash/Beat 'em up, Adventure, Indie","Action, Fantasy","roguelike, metroidvania, online co-op",https://www.youtube.com/watch?v=hdxd-TcYIJc,895342,15657,11/11/2025,Console / Other,11/3/2026
Marathon,Main Game,5/3/2026,Bungie,Bungie,"Xbox Series X|S, PC (Microsoft Windows), PlayStation 5",Shooter,"Action, Science fiction","cybernetics, character customization, pvp, futuristic, team-based, cross-platform multiplayer, controller support, extraction shooter, nextfest february 2026",https://www.youtube.com/watch?v=lygqlbSi9TE,121583,3313,12/2/2026,PC Game (on Steam),11/3/2026
Docked,Main Game,5/3/2026,Saber Interactive,Saber Interactive,"Xbox Series X|S, PC (Microsoft Windows), PlayStation 5",Simulator,,,https://www.youtube.com/watch?v=XF-UiAo8bFY,22847,324,4/2/2026,Console / Other,11/3/2026
Planet of Lana II: Children of the Leaf,Main Game,5/3/2026,Wishfully,Thunderful,"Xbox Series X|S, PlayStation 4, Nintendo Switch 2, PC (Microsoft Windows), PlayStation 5, Xbox One, Nintendo Switch","Platform, Puzzle, Adventure","Action, Science fiction","atmospheric, steam cloud, controller recommendation, puzzle platformer, controller support, nextfest february 2026",https://www.youtube.com/watch?v=DCaHB5i0XD8,26,1,24/2/2026,Console / Other,11/3/2026
Portrait of a Torn,Main Game,5/3/2026,Indigo Studios - Interactive Stories,Poysky Productions,"Xbox Series X|S, PC (Microsoft Windows), PlayStation 5","Adventure, Indie",,,https://www.youtube.com/watch?v=RUJyAvsw8w8,768,10,10/2/2026,Console / Other,11/3/2026
Trail Out,Main Game,5/3/2026,Good Boys,Crytivo,"Xbox Series X|S, PC (Microsoft Windows), PlayStation 5, Nintendo Switch","Racing, Simulator, Sport, Indie, Arcade",Action,"driving, bullet time, demo, narration, free demo",https://www.youtube.com/watch?v=oVXY4yesEGc,3275,95,5/3/2026,Console / Other,11/3/2026
Citadelum,Main Game,5/3/2026,Abylight Barcelona,Abylight Studios,"Xbox Series X|S, Nintendo Switch 2, PC (Microsoft Windows), PlayStation 5","Simulator, Strategy, Indie",Historical,"city builder, rome",https://www.youtube.com/watch?v=IiIlVmfr2pc,4004,98,10/9/2024,Console / Other,11/3/2026
WWE 2K26,Main Game,6/3/2026,Visual Concepts,2K,"Xbox Series X|S, Nintendo Switch 2, PC (Microsoft Windows), PlayStation 5","Fighting, Simulator, Sport",Action,wrestling,https://www.youtube.com/watch?v=oYd6rXOrz7E,269751,10753,31/1/2026,Console / Other,11/3/2026
The Bearer & The Last Flame,Main Game,6/3/2026,Dark Reaper Studio,Meridiem Games,"PC (Microsoft Windows), PlayStation 5","Adventure, Indie","Action, Fantasy","dark fantasy, soulslike, nextfest february 2026",https://www.youtube.com/watch?v=lIZ7JfpPqeI,12475,150,3/9/2023,Console / Other,11/3/2026
Mirage 7,Main Game,6/3/2026,Drakkar Dev,Blowfish Studios,"Xbox Series X|S, PlayStation 4, PC (Microsoft Windows), PlayStation 5, Mac, Xbox One","Puzzle, Adventure, Indie","Action, Fantasy, Science fiction","animal companions, desert",https://www.youtube.com/watch?v=eWNOot152Xs,5372,47,4/2/2026,Console / Other,11/3/2026
Sumerian Six,Main Game,6/3/2026,Artificer,Devolver Digital,"Xbox Series X|S, PC (Microsoft Windows), PlayStation 5","Strategy, Tactical, Adventure","Action, Science fiction, Historical, Stealth, Warfare","world war ii - ww2, 1940s, real time tactics, nazis, nazi occultism, alternative history",https://www.youtube.com/watch?v=IZh9idZ7c9c,2459,20,3/2/2026,Console / Other,11/3/2026
Order 13,Main Game,6/3/2026,Cybernetic Walrus,"Oro Interactive, JanduSoft S.L.","Xbox Series X|S, PC (Microsoft Windows), PlayStation 5","Simulator, Adventure, Indie","Action, Horror, Thriller, Survival, Mystery",,https://www.youtube.com/watch?v=i8r0pG5WTrU,2959,124,3/3/2025,Console / Other,11/3/2026
Horror Tale 3: The Witch,Main Game,6/3/2026,Euphoria Games,"Euphoria Games, EpiXR Games","Android, PC (Microsoft Windows), iOS, PlayStation 5, Nintendo Switch","Puzzle, Adventure, Arcade","Action, Horror, Mystery",,https://www.youtube.com/watch?v=UdVo5Wc9c5Y,107712,1768,31/3/2025,Console / Other,11/3/2026
Fortuna Magus,Main Game,6/3/2026,WorldWide Software,Kemco,"Xbox Series X|S, PlayStation 4, Android, PC (Microsoft Windows), PlayStation 5, Xbox One, Nintendo Switch","Role-playing (RPG), Simulator, Strategy, Turn-based strategy (TBS), Adventure",,,https://www.youtube.com/watch?v=VZR3EpJXZLA,98652,219,1/11/2013,Console / Other,11/3/2026
Outbreak: Shades of Horror,Main Game,6/3/2026,Dead Drop Studios LLC,Dead Drop Studios LLC,"Xbox Series X|S, PC (Microsoft Windows), PlayStation 5","Shooter, Adventure","Action, Horror",,https://www.youtube.com/watch?v=oXcc6eCfpYY,302,3,19/12/2025,Console / Other,11/3/2026
Road Jumper,Main Game,7/3/2026,Gametry,Gametry,"PlayStation 4, PlayStation 5",Racing,,,No YouTube video found,,,,Console / Other,11/3/2026
Chicken Rescue,Main Game,9/3/2026,PowerSlash Studios,"PowerSlash Studios, y-zo studio","Xbox Series X|S, PlayStation 4, PC (Microsoft Windows), PlayStation 5, Xbox One",Platform,,,https://www.youtube.com/watch?v=eRitJJmmKCc,174,3,8/3/2026,Console / Other,11/3/2026
Unsealed: The Mare,Main Game,10/3/2026,Gamhalla,,"Xbox Series X|S, PC (Microsoft Windows), PlayStation 5",Indie,Horror,"dark, atmospheric, psychological, nextfest february 2026",https://www.youtube.com/watch?v=sw_QOhbj0mY,1032,7,30/1/2026,Console / Other,11/3/2026
Retina Rush,Main Game,10/3/2026,CraePlay,GGmuks Inc.,"PlayStation 4, PlayStation 5",Arcade,Action,endless runner,No YouTube video found,,,,Console / Other,11/3/2026
Öoo,Main Game,11/3/2026,NamaTakahashi,,"Xbox Series X|S, PC (Microsoft Windows), PlayStation 5, Nintendo Switch","Platform, Puzzle, Adventure, Indie",Action,bombs,https://www.youtube.com/watch?v=mGlNxjg3zDI,21322,370,3/3/2026,Console / Other,11/3/2026
RoadOut,Main Game,12/3/2026,Rastrolabs,DANGEN Entertainment,"Xbox Series X|S, PC (Microsoft Windows), PlayStation 5, Nintendo Switch","Racing, Role-playing (RPG), Adventure, Indie","Action, Survival",,https://www.youtube.com/watch?v=rRjzSRrxXnk,243,15,10/12/2025,Console / Other,11/3/2026
John Carpenter's Toxic Commando,Main Game,12/3/2026,Saber Interactive,Focus Entertainment,"Xbox Series X|S, PC (Microsoft Windows), PlayStation 5","Shooter, Adventure","Action, Horror","online multiplayer, nextfest february 2026",https://www.youtube.com/watch?v=svWU-rezMu0,37056,771,12/12/2025,Console / Other,11/3/2026
1348: Ex Voto,Main Game,12/3/2026,Sedleo,Dear Villagers,"Xbox Series X|S, PC (Microsoft Windows), PlayStation 5","Adventure, Indie","Action, Historical, Drama",nextfest february 2026,https://www.youtube.com/watch?v=MzjshfDkW1c,64322,1828,21/1/2026,Console / Other,11/3/2026
GreedFall: The Dying World,Main Game,12/3/2026,Spiders,Nacon,"Xbox Series X|S, PC (Microsoft Windows), PlayStation 5","Role-playing (RPG), Adventure","Action, Fantasy, Science fiction",,https://www.youtube.com/watch?v=UC467B_HoQ8,151266,98,5/2/2026,Console / Other,11/3/2026
Collector's Cove,Main Game,12/3/2026,VoodooDuck,VoodooDuck,"PC (Microsoft Windows), PlayStation 5, Nintendo Switch","Simulator, Adventure, Indie",,"exploration, farming, cozy, ocean, nextfest february 2026",https://www.youtube.com/watch?v=QzFj2hS3Yrg,24,2,20/2/2026,Console / Other,11/3/2026
MLB The Show 26,Main Game,12/3/2026,SIE San Diego Studio,Sony Interactive Entertainment,"Xbox Series X|S, PC (Microsoft Windows), PlayStation 5, Nintendo Switch","Simulator, Sport",,,https://www.youtube.com/watch?v=xfsvi2X37z8,3571297,546,27/1/2026,Non-Steam PC Game,11/3/2026
Fatal Frame II: Crimson Butterfly Remake - Digital Deluxe Edition,Main Game,12/3/2026,,,"Xbox Series X|S, Nintendo Switch 2, PC (Microsoft Windows), PlayStation 5",,,,No YouTube video found,,,,Console / Other,11/3/2026
Monster Hunter Stories 3: Twisted Reflection,Main Game,13/3/2026,Capcom,Capcom,"Xbox Series X|S, Nintendo Switch 2, PC (Microsoft Windows), PlayStation 5","Role-playing (RPG), Adventure",Action,nextfest february 2026,https://www.youtube.com/watch?v=uM6pjBnv5Ig,88492,6812,6/3/2026,Console / Other,11/3/2026
Don't Mess With Bober,Main Game,13/3/2026,Peace Studio,,"Xbox Series X|S, PlayStation 4, PC (Microsoft Windows), PlayStation 5, Xbox One, Nintendo Switch","Puzzle, Simulator, Adventure, Indie","Action, Horror, Stealth, Comedy",ai-generated voices,https://www.youtube.com/watch?v=u_ggR44XJu0,30,0,23/2/2026,Console / Other,11/3/2026
Sovereign Brain Empire,Main Game,13/3/2026,Mountain and Sea Studio,Mountain and Sea Studio,"PC (Microsoft Windows), PlayStation 5","Role-playing (RPG), Simulator, Strategy, Adventure, Indie",,,No YouTube video found,,,,Console / Other,11/3/2026
Starship Troopers: Ultimate Bug War!,Main Game,16/3/2026,Auroch Digital,DotEmu,"Xbox Series X|S, Nintendo Switch 2, PC (Microsoft Windows), PlayStation 5","Shooter, Adventure, Indie","Action, Science fiction","steam achievements, subtitled silence, adjustable difficulty, accessibility options, fmv, save anytime, playable without timed input, stereo sound, custom volume controls, camera comfort, nextfest february 2026",https://www.youtube.com/watch?v=tc5KpCp-CFU,359107,349,11/2/2026,Console / Other,11/3/2026
The Seven Deadly Sins: Origin,Main Game,16/3/2026,Netmarble F&C,Netmarble,"Android, PC (Microsoft Windows), iOS, PlayStation 5","Role-playing (RPG), Adventure","Action, Fantasy, Open world",,https://www.youtube.com/watch?v=D4I3iia76NA,81331,2913,24/2/2026,Console / Other,11/3/2026
Checkmate Survivors,Main Game,16/3/2026,RainForest Games,"RainForest Games, y-zo studio","Xbox Series X|S, PlayStation 4, PlayStation 5","Shooter, Strategy",Kids,,No YouTube video found,,,,Console / Other,11/3/2026
Grind Survivors,Main Game,16/3/2026,,Assemble Entertainment,"Xbox Series X|S, PC (Microsoft Windows), PlayStation 5",Indie,Action,"accessibility options, playable without timed input, custom volume controls",https://www.youtube.com/watch?v=nWhyW_1H0U8,3658,51,21/8/2025,Console / Other,11/3/2026
