Game Title,Category,Release Date,1,Publishers,Platforms,Genres,Themes,Keywords,YouTube URL,YouTube Views,YouTube Likes,YouTube ReleaseDate,SteamStatus,Unnamed: 14
Starship Troopers: Ultimate Bug War!,Main Game,3/16/2026,Auroch Digital,DotEmu,"Xbox Series X|S, Nintendo Switch 2, PC (Microsoft Windows), PlayStation 5","Shooter, Adventure, Indie, Arcade","Action, Science fiction","steam achievements, subtitled silence, adjustable difficulty, accessibility options, fmv, save anytime, playable without timed input, stereo sound, custom volume controls, camera comfort, nextfest february 2026",https://www.youtube.com/watch?v=Y_cSUPKOOGs,11585,197,3/16/2026,PC Game (on Steam),
The Seven Deadly Sins: Origin,Main Game,3/16/2026,Netmarble F&C,Netmarble,"Android, PC (Microsoft Windows), iOS, PlayStation 5","Role-playing (RPG), Adventure","Action, Fantasy, Open world",,https://www.youtube.com/watch?v=D4I3iia76NA,100953,3131,2/24/2026,PC Game (on Steam),
Checkmate Survivors,Main Game,3/16/2026,RainForest Games,"RainForest Games, y-zo studio","Xbox Series X|S, PlayStation 4, PlayStation 5","Shooter, Strategy",Kids,,https://www.youtube.com/watch?v=QnkDR1DnJSs,22,1,3/15/2026,Console / Other,
Grind Survivors,Main Game,3/16/2026,Pushka Studios,Assemble Entertainment,"Xbox Series X|S, PC (Microsoft Windows), PlayStation 5",Indie,Action,"accessibility options, playable without timed input, custom volume controls",https://www.youtube.com/watch?v=oNvW3_3WOe8,4699,55,3/16/2026,PC Game (on Steam),
Dragonkin: The Banished,Main Game,3/16/2026,EKO Software,Nacon,"Xbox Series X|S, PC (Microsoft Windows), PlayStation 5","Role-playing (RPG), Hack and slash/Beat 'em up, Adventure","Action, Fantasy","dark fantasy, dungeon crawling, steam achievements, xbox controller support for pc, steam cloud, controller support, steam remote play",https://www.youtube.com/watch?v=9tT30t0TURI,24629,190,3/16/2026,PC Game (on Steam),
Royal Revolt Survivors,Main Game,3/16/2026,Team Warriors,Headup Games,"Linux, Nintendo Switch 2, PC (Microsoft Windows), PlayStation 5","Role-playing (RPG), Adventure, Indie, Arcade",Action,"shared screen, roguelite, action roguelike",https://www.youtube.com/watch?v=-N8uqHNJ7zM,297,12,7/25/2025,PC Game (on Steam),
MLB The Show 26,Main Game,3/17/2026,SIE San Diego Studio,Sony Interactive Entertainment,"Xbox Series X|S, PC (Microsoft Windows), PlayStation 5, Nintendo Switch","Simulator, Sport",,,https://www.youtube.com/watch?v=xfsvi2X37z8,3571883,550,1/27/2026,Non-Steam PC Game,
Emotionless: The Last Ticket,Main Game,3/17/2026,X1 Games,X1 Games,"Xbox Series X|S, PC (Microsoft Windows), PlayStation 5","Simulator, Adventure","Horror, Mystery","amusement park, multiple endings, walking simulator, atmospheric, cosmic horror, steam cloud, liminal space, nextfest june 2025",https://www.youtube.com/watch?v=4t4pg2UtDmk,354,3,1/30/2026,Console / Other,
Thomas & Friends: Wonders of Sodor,Main Game,3/17/2026,Dovetail Games,Dovetail Games,"Xbox Series X|S, PlayStation 4, PC (Microsoft Windows), PlayStation 5, Xbox One, Nintendo Switch","Simulator, Adventure","Sandbox, Kids, Open world","train simulator, accessibility options, thomas the tank, subtitles, playable without timed input, custom volume controls, stero sound",https://www.youtube.com/watch?v=6uxh5at-VWU,54107,2525,3/17/2026,PC Game (on Steam),
Dread Delusion,Main Game,3/17/2026,Lovely Hellplace,DreadXP,"Xbox Series X|S, PlayStation 4, Nintendo Switch 2, PC (Microsoft Windows), PlayStation 5, Xbox One","Role-playing (RPG), Adventure, Indie","Action, Fantasy, Horror, Open world","retro, magic, 3d, ps1 inspired, low-poly, polygonal 3d, arpg",https://www.youtube.com/watch?v=gUoDrs7nN_M,9236,257,6/15/2022,Console / Other,
Overthrown,Main Game,3/18/2026,,Maximum Entertainment,"Xbox Series X|S, PC (Microsoft Windows), PlayStation 5","Platform, Simulator, Strategy, Indie","Fantasy, Business, Sandbox","management, city builder",https://www.youtube.com/watch?v=OdrKvRtzYy4,8736,51,9/15/2025,PC Game (on Steam),
Goritaire,Main Game,3/18/2026,Arc System Works,Arc System Works,"PlayStation 4, Android, PC (Microsoft Windows), iOS, PlayStation 5, Nintendo Switch",Card & Board Game,,solitaire,,,,,PC Game (on Steam),
Crimson Desert,Main Game,3/19/2026,Pearl Abyss,Pearl Abyss,"Xbox Series X|S, PC (Microsoft Windows), PlayStation 5, Mac",Adventure,"Action, Fantasy, Open world",,,,,,PC Game (on Steam),
Rushing Beat X: Return of Brawl Brothers,Main Game,3/19/2026,City Connection,"Clear River Games, City Connection","Xbox Series X|S, Nintendo Switch 2, PC (Microsoft Windows), PlayStation 5","Fighting, Hack and slash/Beat 'em up, Arcade",Action,"controller required, nextfest june 2025",https://www.youtube.com/watch?v=BoYXzYmGD1s,4586,147,11/12/2025,PC Game (on Steam),
The Little Tomb: The Maholova Club and the Search for a Dead Body,Main Game,3/19/2026,CAVYHOUSE,PLAYISM,"PlayStation 4, PC (Microsoft Windows), PlayStation 5, Nintendo Switch","Adventure, Indie","Comedy, Mystery",nextfest june 2025,https://www.youtube.com/watch?v=p61unfK76-A,1024,28,2/26/2026,Console / Other,
The Coin Game,Main Game,3/19/2026,devotid Media,devotid Media,"Xbox Series X|S, PC (Microsoft Windows), PlayStation 5","Simulator, Adventure, Indie","Comedy, Sandbox","resource management, management, satire, time management",https://www.youtube.com/watch?v=hHmgJpjuWnk,4553,89,3/5/2026,PC Game (on Steam),
Wuthering Waves: Resolution to Illuminate the Shadows,Unknown,3/19/2026,Kuro Games,Kuro Games,"Android, PC (Microsoft Windows), iOS, PlayStation 5, Mac","Role-playing (RPG), Adventure","Action, Fantasy, Science fiction, Open world",,https://www.youtube.com/watch?v=aMAJhkp0hlc,3447768,12115,3/13/2026,Non-Steam PC Game,
Voidwrought,Main Game,3/19/2026,Powersnake,Kwalee,"Xbox Series X|S, PC (Microsoft Windows), PlayStation 5, Nintendo Switch","Platform, Indie",Action,,https://www.youtube.com/watch?v=hKKBetnq-UY,33637,1039,3/20/2026,Console / Other,
No-Skin,Main Game,3/19/2026,NoEye-Soft,NoEye-Soft,"PlayStation 4, PC (Microsoft Windows), PlayStation 5, Xbox One, Nintendo Switch","Role-playing (RPG), Strategy, Turn-based strategy (TBS), Adventure, Indie",Horror,roguelike,https://www.youtube.com/watch?v=gsip7quhhIc,1333,55,2/18/2025,Console / Other,
Hoof & Seek,Main Game,3/19/2026,,,"PlayStation 4, PlayStation 5, Nintendo Switch",Puzzle,,,,,,,Console / Other,
Crimson Desert: Deluxe Edition,Main Game,3/19/2026,Pearl Abyss,Pearl Abyss,"Xbox Series X|S, PC (Microsoft Windows), PlayStation 5, Mac",Adventure,"Action, Fantasy, Open world",,https://www.youtube.com/watch?v=VWIw_f8e9Pg,969563,40337,3/12/2026,Non-Steam PC Game,
Rubato,Main Game,3/20/2026,dconn,"Headcannon, dconn","Xbox Series X|S, PC (Microsoft Windows), PlayStation 5, Nintendo Switch","Platform, Puzzle, Role-playing (RPG), Adventure, Indie","Action, Comedy",frog,https://www.youtube.com/watch?v=fY4pZovL1Uo,288454,28425,1/20/2026,PC Game (on Steam),
Machine Gun Fury,Main Game,3/20/2026,Reset Games,Reset Games,"Xbox Series X|S, PlayStation 4, PC (Microsoft Windows), PlayStation 5, Xbox One, Nintendo Switch","Shooter, Platform, Indie, Arcade",Action,"retro, retro graphics",https://www.youtube.com/watch?v=xiSQJgpWU-k,626,8,8/8/2022,Console / Other,
Mote: The Old Office,Main Game,3/20/2026,CraePlay,GGmuks Inc.,"PlayStation 4, PlayStation 5","Simulator, Adventure",,"walking simulator, tiny protagonist",,,,,Console / Other,
Mamon King,Main Game,3/20/2026,LiTMUS,LiTMUS,"PC (Microsoft Windows), PlayStation 5, Nintendo Switch","Role-playing (RPG), Simulator, Strategy, Indie",Fantasy,"steam, battle, farming simulator, nintendo switch eshop, farm, command-based, monster",,,,,Console / Other,
Ghost Master: Resurrection - Core Edition,Main Game,3/20/2026,,,"PlayStation 5, Nintendo Switch",,,,,,,,Console / Other,
Tiny Archer,Main Game,3/23/2026,Head Bear Games,"Head Bear Games, y-zo studio","Xbox Series X|S, PlayStation 4, PC (Microsoft Windows), PlayStation 5, Xbox One","Platform, Adventure",,,https://www.youtube.com/watch?v=7dlImcuRbp0,11,1,3/22/2026,Console / Other,
Ariana and the Elder Codex,Main Game,3/24/2026,Hyde,"Compile Heart, Idea Factory, Idea Factory International, Inc.","PlayStation 4, PC (Microsoft Windows), PlayStation 5, Nintendo Switch","Platform, Role-playing (RPG), Adventure","Action, Fantasy","side-scrolling, action-rpg",https://www.youtube.com/watch?v=AllbhGbWjCI,61272,2654,10/23/2025,Console / Other,
Zenless Zone Zero: Update 2.7 - Champions Never Fall to the Past,Unknown,3/24/2026,"HoYoverse, Cognosphere","HoYoverse, Cognosphere","Xbox Series X|S, Android, PC (Microsoft Windows), iOS, PlayStation 5","Role-playing (RPG), Hack and slash/Beat 'em up, Adventure",Action,,https://www.youtube.com/watch?v=QoixgtmqRvo,216608,13172,3/14/2026,Non-Steam PC Game,
Damon and Baby,Main Game,3/25/2026,Arc System Works,Arc System Works,"PlayStation 4, PC (Microsoft Windows), PlayStation 5, Nintendo Switch","Shooter, Adventure",Action,"twin stick control, twin stick, nextfest february 2026",https://www.youtube.com/watch?v=hHY9opUFrRw,11609,191,2/12/2026,PC Game (on Steam),
Honkai: Star Rail - Unraveled for Daybreak,Unknown,3/25/2026,"HoYoverse, Cognosphere","HoYoverse, Cognosphere","Android, PC (Microsoft Windows), iOS, PlayStation 5","Role-playing (RPG), Turn-based strategy (TBS)","Action, Fantasy",,https://www.youtube.com/watch?v=HqQqHgt4frU,1021442,14455,3/13/2026,Non-Steam PC Game,
Legendary Spell,Main Game,3/25/2026,,Happy Player,"PlayStation 5, Nintendo Switch","Role-playing (RPG), Strategy, Adventure",,,,,,,Console / Other,
Ghost at Dawn,Main Game,3/25/2026,Blue and Red Games,Blue and Red Games,"PlayStation 4, PC (Microsoft Windows), PlayStation 5","Adventure, Indie","Action, Horror, Survival","ghosts, anime, detective, 1940s, permadeath, noir, multiple endings, inventory management, fixed camera, jump scare moment, tank controls",,,,,Console / Other,
Etrange Overlord,Main Game,3/26/2026,"Gemdrops, Inc., SuperNiche, Broccoli","NIS America, Inc.","PlayStation 4, PC (Microsoft Windows), PlayStation 5, Nintendo Switch",Role-playing (RPG),Action,,https://www.youtube.com/watch?v=0fE4ajU1hlw,8644,247,3/12/2026,PC Game (on Steam),
Curse Warrior,Main Game,3/26/2026,"Nippon Ichi Software, GuruGuru",,"PlayStation 4, PlayStation 5, Nintendo Switch",Role-playing (RPG),,,https://www.youtube.com/watch?v=SNMV6MMMZ_Y,128738,1362,12/11/2025,Console / Other,
The Bus,Main Game,3/26/2026,TML-Studios,Aerosoft,"Xbox Series X|S, PC (Microsoft Windows), PlayStation 5",Simulator,"Sandbox, Open world","germany, bus simulation",https://www.youtube.com/watch?v=KRctgjKxttU,34656,803,12/18/2025,PC Game (on Steam),
Life is Strange: Reunion,Main Game,3/26/2026,Deck Nine,Square Enix,"Xbox Series X|S, PC (Microsoft Windows), PlayStation 5",Adventure,Action,,https://www.youtube.com/watch?v=ilDm1_jlWbM,272073,740,3/12/2026,PC Game (on Steam),
Project Songbird,Main Game,3/26/2026,FYRE Games,FYRE Games,"Xbox Series X|S, PC (Microsoft Windows), PlayStation 5","Adventure, Indie","Action, Horror",nextfest february 2026,https://www.youtube.com/watch?v=zbHnIA6UKtM,78639,32,3/26/2026,PC Game (on Steam),
Screamer,Main Game,3/26/2026,Milestone,Milestone,"Xbox Series X|S, PC (Microsoft Windows), PlayStation 5",Racing,,,https://www.youtube.com/watch?v=vSIxAuvt4RY,33901,423,3/26/2026,PC Game (on Steam),
Devil Jam,Main Game,3/26/2026,Rogueside,Rogueside,"Xbox Series X|S, PlayStation 4, PC (Microsoft Windows), PlayStation 5, Mac, Nintendo Switch","Adventure, Arcade",Action,,https://www.youtube.com/watch?v=gKFd9RSj8gQ,1519,22,3/4/2026,Console / Other,
Trash Goblin,Main Game,3/26/2026,Spilt Milk Studios Ltd,Spilt Milk Studios Ltd,"Xbox Series X|S, PC (Microsoft Windows), PlayStation 5, Nintendo Switch","Simulator, Indie","Fantasy, Business","capitalism, relaxing, virtual shop, wholesome, cozy",https://www.youtube.com/watch?v=NPymMM3M2cE,1430,17,3/12/2026,Console / Other,
Shardpunk,Main Game,3/26/2026,Clockwork Pile,Retrovibe,"Xbox Series X|S, PlayStation 4, PC (Microsoft Windows), PlayStation 5, Xbox One, Nintendo Switch","Role-playing (RPG), Strategy, Turn-based strategy (TBS), Tactical",Science fiction,,https://www.youtube.com/watch?v=ui6LQlp59aQ,1806,40,8/14/2021,Console / Other,
Final Payload,Main Game,3/26/2026,"KazakovStudios, SharkGame","KazakovStudios, y-zo studio","PlayStation 4, PC (Microsoft Windows), PlayStation 5",Arcade,,,https://www.youtube.com/watch?v=_-_-EAHdWno,16,2,3/25/2026,Console / Other,
Vanishing Starlight,Main Game,3/26/2026,Heart Seven,Gamepoch,"PC (Microsoft Windows), PlayStation 5","Adventure, Indie",Action,metroidvania,https://www.youtube.com/watch?v=sUZQDofWyzk,37250,1255,3/18/2026,Non-Steam PC Game,
Easy Delivery Co.,Main Game,3/26/2026,Sam Cameron,Oro Interactive,"Xbox Series X|S, Android, PC (Microsoft Windows), iOS, PlayStation 5, Xbox One, Nintendo Switch","Racing, Simulator, Adventure, Indie, Arcade",Open world,"exploration, casual, retro, cars, character customization, interactive fiction, 3d, physics, vehicle simulation, fishing, resource management, cooking, driving, forest, bird, achievements, multiple endings, cute, upgrade, season winter, atmospheric, snow, pixel graphics, capitalism, dog, pizza, relaxing, silent protagonist, emotional, low-poly, story rich, day/night cycle, upgradable equipment, no jumping, snowman, navigation, off-roading, fixed camera, steam achievements, xbox controller support for pc, anthropomorphism, animal protagonists, dualshock 4 support for pc, world map, cat, controller recommendation, vehicle customization, secret area, vending machine interaction, in-game radio, camping, in-game e-mail, burning, upgradeable vehicles, optional lore, text dialogue, remote play, controller support, dogs, furry, retro graphics, collectathon, backrooms, the backrooms, plant, steam deck, codes, food, lore rich, coffee, cafe, digging, trucks, winter, fish, steam families, starting fires, store, mail, money, automobile, hidden secrets, simulated operating system, automobile sim, delivery, plants, morse code, upgrades, dynamic weather, gas station, woodland, stamina",https://www.youtube.com/watch?v=NVL8z8Ib7_Y,4132,39,3/19/2026,Console / Other,
Neopets: Mega Mini Games Collection - The Neopian Arcade Odyssey,Main Game,3/26/2026,,,"PlayStation 4, PC (Microsoft Windows), PlayStation 5, Nintendo Switch",Adventure,Action,,,,,,PC Game (on Steam),
Hello Neighbor,Main Game,3/26/2026,DYNAMIC PIXELS,tinyBuild,"Google Stadia, Xbox Series X|S, PlayStation 4, Android, PC (Microsoft Windows), iOS, PlayStation 5, Xbox One, Nintendo Switch","Puzzle, Role-playing (RPG), Strategy, Adventure, Indie","Action, Horror, Thriller, Stealth, Comedy, Sandbox","steam, achievements, steam achievements, pax west 2017, xbox play anywhere, xbox one x enhanced, pax south 2017, ea app, 4k ultra hd, previously on - stadia pro",https://www.youtube.com/watch?v=Px7EQXeEMd8,2316,74,7/14/2020,Console / Other,
Winning Post 10 2026,Main Game,3/26/2026,,Koei Tecmo Games,"PlayStation 4, Nintendo Switch 2, PC (Microsoft Windows), PlayStation 5, Nintendo Switch",Simulator,Sandbox,"horse racing, horses",https://www.youtube.com/watch?v=zDEgBG4EsOA,712966,1555,1/19/2026,Non-Steam PC Game,
Farm Manager World,Main Game,3/26/2026,Cleversan Games,"Sim Farm, PlayWay S.A.","Xbox Series X|S, PC (Microsoft Windows), PlayStation 5","Simulator, Strategy, Indie","Business, Sandbox",farming simulator,https://www.youtube.com/watch?v=rrUdG9bMNhg,223,6,3/26/2026,Console / Other,
Rooftop Rascal: The Farmer Cat,Main Game,3/26/2026,chroda.eu,chroda.eu,"PlayStation 4, PlayStation 5","Platform, Adventure",,,,,,,Console / Other,
Task Force Ranger: Lead the way!,Main Game,3/27/2026,,Daniel Wengenroth,"PlayStation 5, Nintendo Switch",,,,,,,,Console / Other,
Retro Drive: Revamped,Main Game,3/27/2026,,,"Xbox Series X|S, PlayStation 4, PC (Microsoft Windows), PlayStation 5, Nintendo Switch","Racing, Indie, Arcade",,"colorful, synthwave, police chase, neon",https://www.youtube.com/watch?v=y-9nZ-N_emQ,1265,29,6/25/2025,PC Game (on Steam),
File Destined,Main Game,3/27/2026,Metavision Studio,Metavision Studio,"Xbox Series X|S, PC (Microsoft Windows), PlayStation 5","Adventure, Indie","Action, Horror, Thriller",,https://www.youtube.com/watch?v=P-8iK5PD-r4,1043,11,3/16/2026,Console / Other,
RollerCoaster Tycoon Classic,Main Game,3/27/2026,Origin8,"Atari, Inc.","Xbox Series X|S, Android, PC (Microsoft Windows), iOS, PlayStation 5, Mac, Nintendo Switch","Simulator, Strategy","Business, Sandbox","amusement park, available on - apple arcade",https://www.youtube.com/watch?v=_mvyGjzIvJE,95566,2544,3/27/2026,Console / Other,
Stillbone,Main Game,3/30/2026,2dragontails,"y-zo studio, 2dragontails","Xbox Series X|S, PlayStation 4, PC (Microsoft Windows), PlayStation 5, Xbox One",Platform,,,https://www.youtube.com/watch?v=iD8-OBn5sgA,229,2,3/29/2026,Console / Other,
Fishbowl,Main Game,3/30/2026,imissmyfriends.studio,imissmyfriends.studio,"Linux, PC (Microsoft Windows), PlayStation 5, Mac","Role-playing (RPG), Indie, Visual Novel",,,https://www.youtube.com/watch?v=v-x7R-4hu6o,19,2,2/22/2026,Console / Other,
Bubble Bobble: Sugar Dungeons,Main Game,3/31/2026,Taito,Arc System Works,"PC (Microsoft Windows), PlayStation 5, Nintendo Switch","Platform, Arcade",Action,"roguelike, procedurally generated, roguelite, action roguelike, action roguelite",https://www.youtube.com/watch?v=ZUma2zdhOMU,11538,212,10/30/2025,Console / Other,
Gallipoli,Main Game,3/31/2026,Blackmill Games,Blackmill Games,"Xbox Series X|S, PC (Microsoft Windows), PlayStation 5","Shooter, Simulator, Strategy, Indie","Action, Historical, Warfare",world war i - ww1,https://www.youtube.com/watch?v=Slf1KTFbv4I,57937,2646,2/27/2026,Console / Other,
Possessions,Main Game,3/31/2026,Lucid Labs,"Noodlecake Studios, Lucid Labs","Xbox Series X|S, Linux, Nintendo Switch 2, Android, PC (Microsoft Windows), iOS, Meta Quest 3, PlayStation 5, Mac, Nintendo Switch","Puzzle, Adventure, Indie","Fantasy, Drama, Romance","casual, narrative-driven, low-poly, illusion",https://www.youtube.com/watch?v=cu-po24Wm5g,84,0,2/11/2025,Console / Other,
Baptiste,Main Game,3/31/2026,,Firenut Games,"Xbox Series X|S, Nintendo Switch 2, PC (Microsoft Windows), PlayStation 5","Adventure, Indie","Horror, Survival","psychological horror, survival horror, steam achievements, single-player only, steam families",https://www.youtube.com/watch?v=ZKCGQUiZPi0,270,12,12/14/2025,Console / Other,
Hunt the Night,Main Game,3/31/2026,Moonlight Games,DANGEN Entertainment,"Xbox Series X|S, PlayStation 4, PC (Microsoft Windows), PlayStation 5, Xbox One, Nintendo Switch","Role-playing (RPG), Hack and slash/Beat 'em up, Adventure, Indie","Action, Fantasy, Horror","2d, gothic, dark fantasy, pixel graphics, soulslike",https://www.youtube.com/watch?v=yx9pp03mvew,3064,89,9/2/2021,Console / Other,
Deck of Haunts,Main Game,3/31/2026,Mantis,DANGEN Entertainment,"Xbox Series X|S, PC (Microsoft Windows), PlayStation 5, Nintendo Switch","Simulator, Strategy, Adventure, Indie",Horror,"steam achievements, free demo, steam families",https://www.youtube.com/watch?v=Tx2T21DNvyU,1541,31,4/15/2025,Console / Other,
Fate Trigger,Main Game,3/31/2026,Saroasis Studios,Saroasis Studios,"PC (Microsoft Windows), PlayStation 5","Shooter, Tactical, Adventure, MOBA",Action,"anime, 3d",https://www.youtube.com/watch?v=tvbnSzwOhCA,2230421,8206,8/19/2025,Console / Other,
Endurance Motorsport Series,Main Game,3/31/2026,KT Racing,Nacon,"Xbox Series X|S, PC (Microsoft Windows), PlayStation 5","Simulator, Sport",,,https://www.youtube.com/watch?v=-iZBTAKOGSI,34699,417,2/29/2024,Console / Other,
Pao Pao,Main Game,3/31/2026,ArtDock,ArtDock,"Xbox Series X|S, PC (Microsoft Windows), PlayStation 5, Nintendo Switch","Simulator, Adventure, Indie",Action,"animals, cooking, management, semi open world, animal crossing, online coop, overcooked, cooking simulation",https://www.youtube.com/watch?v=DVMk8hlv4Zo,65,1,9/18/2025,Console / Other,
One Card One Shot: Mafia,Main Game,3/31/2026,,,"Xbox Series X|S, PC (Microsoft Windows), PlayStation 5, Nintendo Switch","Role-playing (RPG), Strategy, Indie",Action,free demo,https://www.youtube.com/watch?v=q6Z9z0CbrE0,104,4,12/10/2025,Console / Other,
Kristala,Main Game,3/31/2026,Astral Clocktower Studios,Astral Clocktower Studios,"Xbox Series X|S, PC (Microsoft Windows), PlayStation 5","Role-playing (RPG), Adventure, Indie","Action, Fantasy","dark fantasy, cat, soulslike",https://www.youtube.com/watch?v=zILZ8ukwUXs,1214,43,10/14/2024,Console / Other,
Indoor Baseball,Main Game,3/31/2026,Snow Day Software,Snow Day Software,"Xbox Series X|S, PC (Microsoft Windows), PlayStation 5, Nintendo Switch","Sport, Indie, Arcade","Action, Comedy, Kids",baseball,https://www.youtube.com/watch?v=LdCEsPuuIzc,569,8,1/31/2025,Console / Other,
Unmourned,Main Game,3/31/2026,Codebros,Codebros,"PC (Microsoft Windows), PlayStation 5","Simulator, Adventure, Indie","Action, Horror, Mystery",psychological horror,https://www.youtube.com/watch?v=DNZPBbLCF1g,2150,42,8/20/2025,Console / Other,
Elementallis,Main Game,3/31/2026,Iván Ruiz Lozano,Top Hat Studios,"Xbox Series X|S, PlayStation 4, Linux, PC (Microsoft Windows), PlayStation 5, Mac, Nintendo Switch","Puzzle, Role-playing (RPG), Adventure",Action,"exploration, 2d, crowdfunding - kickstarter, story rich, nextfest june 2025",https://www.youtube.com/watch?v=6JT1RkQuXEM,723,75,4/22/2025,Console / Other,
Legacy of Kain: Ascendance,Main Game,3/31/2026,Bit Bot Media,Crystal Dynamics,"Xbox Series X|S, PlayStation 4, PC (Microsoft Windows), PlayStation 5, Nintendo Switch","Platform, Adventure",Action,,https://www.youtube.com/watch?v=XkdJoWcLv0E,19634,1131,2/12/2026,Console / Other,
South of Midnight,Main Game,3/31/2026,Compulsion Games,Xbox Game Studios,"Xbox Series X|S, Nintendo Switch 2, PC (Microsoft Windows), PlayStation 5","Platform, Adventure","Action, Fantasy","magic, gothic, female protagonist, black protagonist, southern american themes, controller support, gothic horror, steam deck, southern gothic",https://www.youtube.com/watch?v=7kdHJKWy610,144246,4773,3/6/2026,Console / Other,
Grime II,Main Game,3/31/2026,Clover Bite,Kwalee,"Xbox Series X|S, PC (Microsoft Windows), PlayStation 5","Role-playing (RPG), Indie","Action, Fantasy","metroidvania, nextfest february 2026",https://www.youtube.com/watch?v=OvJGpXS1f8o,3720,155,3/17/2026,Console / Other,
Super Meat Boy 3D,Main Game,3/31/2026,Team Meat,Headup Games,"Xbox Series X|S, Nintendo Switch 2, PC (Microsoft Windows), PlayStation 5","Platform, Indie, Arcade",Action,,https://www.youtube.com/watch?v=u_X9wb5iYxc,3470662,1069,3/26/2026,PC Game (on Steam),
Go Home Annie: An SCP Game,Main Game,3/31/2026,Misfit Village,Nordcurrent Labs,"Xbox Series X|S, PC (Microsoft Windows), PlayStation 5","Puzzle, Simulator, Adventure, Indie","Action, Horror","exploration, weird, high definition graphics",https://www.youtube.com/watch?v=QDWdCt-O83w,404,8,3/31/2026,Console / Other,
Morkull: Ascend to the Gods,Main Game,4/1/2026,Disaster Games,Dojo System,"PC (Microsoft Windows), PlayStation 5","Adventure, Indie",Action,"steam achievements, nextfest february 2026",,,,,Console / Other,
Lofi Mahjong,Main Game,4/1/2026,Gossiam Games,"y-zo studio, Gossiam Games","PlayStation 4, PC (Microsoft Windows), PlayStation 5","Puzzle, Strategy, Indie, Card & Board Game",,"mahjong, mahjong solitaire",https://www.youtube.com/watch?v=Kbtnbyk9m6A,48,6,10/22/2025,Console / Other,
Darwin's Paradox!,Main Game,4/2/2026,ZDT Studio,Konami,"Xbox Series X|S, Nintendo Switch 2, PC (Microsoft Windows), PlayStation 5","Platform, Puzzle, Adventure, Indie",Action,,https://www.youtube.com/watch?v=2Mzgcj4pGIQ,315159,10977,11/4/2025,Console / Other,
Go! Go! Mister Chickums,Main Game,4/2/2026,com8com1 Software,,"Xbox Series X|S, PC (Microsoft Windows), PlayStation 5, Nintendo Switch","Platform, Indie, Arcade",Action,"retro, 2d, arcade compilation, couch co-op, local co-op, local multiplayer, single screen",https://www.youtube.com/watch?v=TwGVjhfe_Bo,820,17,3/3/2026,Console / Other,
Temtem: Swarm,Main Game,4/2/2026,"GGTECH Studios, CremaGames",CremaGames,"PC (Microsoft Windows), PlayStation 5","Role-playing (RPG), Indie, Arcade","Action, Survival","bullet hell, colorful, steam cloud, swarming enemies, controller support, monster tamer, action roguelike, nextfest october 2024",https://www.youtube.com/watch?v=X96zjtFlEVk,10651,315,3/5/2026,Console / Other,
Clean Up Earth,Main Game,4/2/2026,Magic Pockets,,"Xbox Series X|S, Nintendo Switch 2, PC (Microsoft Windows), PlayStation 5","Simulator, Indie",Action,"simulation, crowdfunding - kickstarter, cleaning, chill, ecosystem, cosy, nextfest february 2026",https://www.youtube.com/watch?v=wEA1PW3m0lk,373179,28,3/12/2026,PC Game (on Steam),
Pulmo,Main Game,4/3/2026,,,"PlayStation 4, PC (Microsoft Windows), PlayStation 5, Nintendo Switch","Puzzle, Adventure, Indie",,,,,,,Console / Other,
Dead Patrol,Main Game,4/6/2026,Magnific Studios,"Magnific Studios, y-zo studio","Xbox Series X|S, PlayStation 4, PC (Microsoft Windows), PlayStation 5, Xbox One",Shooter,,zombies,,,,,Console / Other,
People of Note,Main Game,4/7/2026,Iridium Studios,Annapurna Interactive,"Xbox Series X|S, Nintendo Switch 2, PC (Microsoft Windows), PlayStation 5","Music, Role-playing (RPG), Adventure",Action,"steam achievements, adjustable difficulty, accessibility options, subtitles, save anytime, adjustable text size, color alternatives, playable without timed input, custom volume controls, keyboard only option",https://www.youtube.com/watch?v=8aM8gYssblw,12578,488,2/18/2026,Console / Other,
Peppered: An Existential Platformer,Main Game,4/7/2026,Mostly Games,Mostly Games,"Xbox Series X|S, PlayStation 4, PC (Microsoft Windows), PlayStation 5, Mac, Xbox One, Nintendo Switch","Adventure, Indie","Action, Comedy","2d, narrative-driven, pixel art, multiple storylines, many choices, meaningful choices",https://www.youtube.com/watch?v=0PYfdtlIGNA,1383,78,2/27/2026,Console / Other,
