Game Title,Category,Release Date,1,Publishers,Platforms,Genres,Themes,Keywords,YouTube URL,YouTube Views,YouTube Likes,YouTube ReleaseDate,SteamStatus,Unnamed: 14
Ebola Village,Main Game,23/1/2026,indie_games_studio,"indie_games_studio, Axyos Games","PlayStation 4, PC (Microsoft Windows), PlayStation 5, Nintendo Switch","Shooter, Puzzle, Adventure, Indie","Action, Horror, Survival",,https://www.youtube.com/watch?v=VI0HZ-3mo6w,3787,29,11/6/2023,Console / Other,
Block Cascade,Main Game,23/1/2026,,Webnetic s. r. o.,"PlayStation 4, PlayStation 5",Puzzle,,,No YouTube video found,,,,Console / Other,
Guts 'n Grunts Jr.,Main Game,23/1/2026,Cascadia Games LLC,Cascadia Games LLC,"Xbox Series X|S, PlayStation 4, PC (Microsoft Windows), PlayStation 5, Xbox One, Nintendo Switch",Platform,Action,,No YouTube video found,,,,Non-Steam PC Game,
A Cafe at the End of the World,Main Game,23/1/2026,,,PlayStation 5,Visual Novel,,,No YouTube video found,,,,Console / Other,
Crazy Cats Survivors,Main Game,25/1/2026,,Xeneder Team,"PlayStation 4, PlayStation 5",Shooter,"Action, Fantasy","bullet hell, roguelite",No YouTube video found,,,,Console / Other,
Code Vein II,Main Game,26/1/2026,"Bandai Namco Studios, Shift",Bandai Namco Entertainment,"Xbox Series X|S, PC (Microsoft Windows), PlayStation 5",Role-playing (RPG),Action,"post-apocalyptic, character customization",https://www.youtube.com/watch?v=uF6xLKM-zwg,6236,284,26/1/2026,PC Game (on Steam),
Highguard,Main Game,26/1/2026,Wildlight Entertainment,Wildlight Entertainment,"Xbox Series X|S, PC (Microsoft Windows), PlayStation 5",Shooter,"Action, Fantasy","accessibility options, subtitles, adjustable text size, custom volume controls, surround sound, stero sound",https://www.youtube.com/watch?v=gqFccBZyTaA,25386,418,26/1/2026,PC Game (on Steam),
Speedball,Main Game,27/1/2026,Rebellion Developments,Rebellion Developments,"Xbox Series X|S, PC (Microsoft Windows), PlayStation 5","Sport, Arcade",Action,,https://www.youtube.com/watch?v=CiFz0KJS9t8,12127,190,30/10/2024,PC Game (on Steam),
Ultimate Sheep Raccoon,Main Game,27/1/2026,Clever Endeavour Games,Clever Endeavour Games,"Xbox Series X|S, PlayStation 4, Nintendo Switch 2, PC (Microsoft Windows), PlayStation 5, Xbox One, Nintendo Switch","Racing, Indie","Action, Party",,https://www.youtube.com/watch?v=30uL2cMD_MY,37068,1231,9/12/2025,Console / Other,
Bus Simulator: World Tour,Main Game,27/1/2026,,,"PlayStation 4, PlayStation 5",Simulator,,,No YouTube video found,,,,Console / Other,
Vironics,Main Game,27/1/2026,Dragon Flame Games,Dragon Flame Games,"PC (Microsoft Windows), PlayStation 5",Shooter,Action,,No YouTube video found,,,,Console / Other,
Dorkomon,Main Game,27/1/2026,EpiXR Games,EpiXR Games,PlayStation 5,"Shooter, Adventure",Action,,No YouTube video found,,,,Console / Other,
Core Keeper: Void & Voltage,Unknown,28/1/2026,Pugstorm,Fireshine Games,"Xbox Series X|S, PlayStation 4, Linux, Nintendo Switch 2, PC (Microsoft Windows), PlayStation 5, Xbox One, Nintendo Switch","Role-playing (RPG), Simulator, Adventure, Indie",Action,"steam cloud, steam families",https://www.youtube.com/watch?v=odARerNhDZU,97504,3025,29/11/2025,Console / Other,
Dusk Index: Gion,Main Game,29/1/2026,Cherrymochi,Bushiroad Games,"Xbox Series X|S, PC (Microsoft Windows), PlayStation 5, Nintendo Switch","Adventure, Visual Novel","Thriller, Drama",suspense,https://www.youtube.com/watch?v=6T2fifsjRzA,1868,52,14/1/2025,Console / Other,
Dark Auction,Main Game,29/1/2026,IzanagiGames,"IzanagiGames, Good Smile Company","PC (Microsoft Windows), PlayStation 5, Nintendo Switch",Adventure,Mystery,,No YouTube video found,,,,Console / Other,
I Hate this Place,Main Game,29/1/2026,Rock Square Thunder,"Feardemic, Broken Mirror Games","Xbox Series X|S, PC (Microsoft Windows), PlayStation 5, Nintendo Switch","Shooter, Adventure, Indie","Action, Horror, Survival","crafting, survival horror, steam achievements, xbox controller support for pc, steam cloud, controller support, comicbook style, steam families",https://www.youtube.com/watch?v=cbKJwsJJI4w,2273,18,29/1/2026,Console / Other,
Kyouran Makaism,Main Game,29/1/2026,Nippon Ichi Software,Nippon Ichi Software,"Nintendo Switch 2, PlayStation 5, Nintendo Switch",Role-playing (RPG),Action,,https://www.youtube.com/watch?v=oq_DQ4hnErQ,34836,596,11/11/2025,Console / Other,
Cairn,Main Game,29/1/2026,The Game Bakers,The Game Bakers,"Xbox Series X|S, PC (Microsoft Windows), PlayStation 5","Simulator, Adventure, Indie","Action, Survival","climbing, steam cloud, survival mode",https://www.youtube.com/watch?v=6Ejphz8fY0A,416369,3770,29/1/2026,Console / Other,
Skullbreaker,Main Game,29/1/2026,SharkGame,"Gamesforgames, y-zo studio","PlayStation 4, PC (Microsoft Windows), PlayStation 5","Simulator, Sport, Strategy, Adventure",Action,,https://www.youtube.com/watch?v=BkEn8WA8gXI,11,1,28/1/2026,Console / Other,
Sovereign Syndicate,Main Game,29/1/2026,Crimson Herring Studios Inc.,Crimson Herring Studios Inc.,"PlayStation 4, PC (Microsoft Windows), PlayStation 5","Point-and-click, Role-playing (RPG)",Mystery,,https://www.youtube.com/watch?v=rbxGKcf8DBw,1435,40,16/12/2023,Console / Other,
Majotori,Main Game,29/1/2026,Majorariatto,"Majorariatto, Mameshiba Games","PlayStation 4, Linux, Android, PC (Microsoft Windows), iOS, PlayStation 5, Mac, Nintendo Switch","Puzzle, Quiz/Trivia, Adventure, Indie, Arcade","Fantasy, Comedy, Drama, Educational, Party","anime, casual, magic, mature, witches, multiple endings, dark humor, violent",https://www.youtube.com/watch?v=JHlM6kWii1A,64885,1116,28/3/2017,Console / Other,
67,Main Game,29/1/2026,Oiven Games,Oiven Games,PlayStation 5,,,"brain training, based on - memes",No YouTube video found,,,,Console / Other,
Artifact Seekers,Main Game,29/1/2026,FIVE-BN GAMES,FIVE-BN GAMES,"PC (Microsoft Windows), PlayStation 5, Nintendo Switch","Point-and-click, Adventure",,,No YouTube video found,,,,Console / Other,
Pixel Puzzles Winter Jigsaws,Main Game,29/1/2026,,,"PlayStation 4, PlayStation 5",Puzzle,,,No YouTube video found,,,,Console / Other,
Running Fable Petite Party,Main Game,30/1/2026,Seashell Studio,Seashell Studio,"Xbox Series X|S, PlayStation 4, PC (Microsoft Windows), PlayStation 5, Xbox One, Nintendo Switch","Indie, Arcade, Card & Board Game","Action, Comedy, Kids, Party","minigames, rabbit, cute, cartoon graphics, local multiplayer, dice, easy, turtle, steam achievements, minigame collection, mario party, family, nextfest october 2025",https://www.youtube.com/watch?v=yEVE_UgXJ6Y,13,0,12/9/2025,Console / Other,
The 9th Charnel,Main Game,30/1/2026,Saikat Deb Creations,SOEDESCO Publishing,"Xbox Series X|S, PC (Microsoft Windows), PlayStation 5","Puzzle, Adventure, Indie","Horror, Survival",lovecraftian,https://www.youtube.com/watch?v=u1AZMoREDAE,205,11,14/12/2025,Console / Other,
Disco Simulator,Main Game,30/1/2026,"Frozen Cave Studio, Games Incubator","Games Incubator, Ultimate Games S.A., PlayWay S.A.","Xbox Series X|S, PC (Microsoft Windows), PlayStation 5","Simulator, Strategy, Indie",,,https://www.youtube.com/watch?v=j7setoMva1k,166,5,29/1/2026,Console / Other,
Our Burial Dolls Remastered,Main Game,30/1/2026,,ROSEVERTE,"PlayStation 4, Linux, PC (Microsoft Windows), PlayStation 5, Mac, Nintendo Switch","Role-playing (RPG), Simulator, Adventure, Indie",Horror,,No YouTube video found,,,,Console / Other,
Bumblebee: Search for Happiness,Main Game,30/1/2026,EpiXR Games,EpiXR Games,"PlayStation 5, Xbox One, Nintendo Switch","Simulator, Adventure",Kids,,No YouTube video found,,,,Console / Other,
Avatar Island,Main Game,30/1/2026,,,PlayStation 5,Puzzle,,,No YouTube video found,,,,Console / Other,
Monster Hunter Wilds: Title Update 5,Unknown,1/2/2026,,,"Xbox Series X|S, PC (Microsoft Windows), PlayStation 5",,,,No YouTube video found,,,,Console / Other,
Sanctum Push,Main Game,2/2/2026,2dragontails,"y-zo studio, 2dragontails","Xbox Series X|S, PlayStation 4, PC (Microsoft Windows), PlayStation 5, Xbox One",Puzzle,,sokoban,https://www.youtube.com/watch?v=ZaQ660hS230,16,2,1/2/2026,Console / Other,
Dragon Quest VII: Reimagined - Digital Deluxe Edition,Main Game,3/2/2026,"HexaDrive, Square Enix Creative Studio 5",Square Enix,"Xbox Series X|S, Nintendo Switch 2, PC (Microsoft Windows), PlayStation 5, Nintendo Switch","Role-playing (RPG), Adventure",Fantasy,,No YouTube video found,,,,Console / Other,
Aces of Thunder,Main Game,3/2/2026,Gaijin Entertainment,Gaijin Entertainment,"PlayStation VR2, PC (Microsoft Windows), SteamVR, PlayStation 5",Simulator,"Action, Non-fiction, Warfare","world war ii - ww2, airplane combat, vr experience",https://www.youtube.com/watch?v=brbpCEupa6w,39336,2075,3/2/2026,Console / Other,
Hidden Cats in Christmas,Main Game,4/2/2026,Nukearts,Nukearts,"PlayStation 4, PC (Microsoft Windows), PlayStation 5, Nintendo Switch","Point-and-click, Puzzle, Adventure, Indie, Card & Board Game",,hidden object,No YouTube video found,,,,Console / Other,
Prison Escape Simulator: Dig Out,Main Game,4/2/2026,Digital Melody,PlayWay S.A.,"PC (Microsoft Windows), PlayStation 5, Mac","Simulator, Adventure, Indie",Action,"helicopter, life simulation, basketball, cars, 3d, physics, police, voxel, resource management, slot machine, exercise, gambling, driving, management, trading, achievements, time limit, upgrade, crime, drifting, climbing, realistic, day/night cycle, inventory management, upgradable equipment, navigation, time management, explosion, steam achievements, timer, xbox controller support for pc, dualshock 4 support for pc, explosives, resource gathering, vending machine interaction, invisible wall, sleeping, escaping imprisonment, negotiation, soft reset, controller support, vehicles, roguelite, escape game, islands, underground, ai-generated artwork, food, bombs, coins, decorate, digging, buy and sell, lighthouse, sewer, immersive sim, dirt, steam families, money, imprisoned, time, dualsense support for pc, quest, upgrades, letters, decorating, explosive, cave, stamina, prison",https://www.youtube.com/watch?v=4f0-zHQbedE,358,13,2/2/2026,Console / Other,
Lovish,Main Game,5/2/2026,LABS Works,DANGEN Entertainment,"Xbox Series X|S, PlayStation 4, PC (Microsoft Windows), PlayStation 5, Nintendo Switch","Platform, Role-playing (RPG), Hack and slash/Beat 'em up, Adventure, Indie, Arcade",Action,"retro, 2d, funny, pixel art, love story, 2d animation, steam achievements, cartoon cutscene",https://www.youtube.com/watch?v=bJfogOqxJAE,19453,750,21/11/2024,Console / Other,
Hollow Knight,Main Game,5/2/2026,Team Cherry,Team Cherry,"Xbox Series X|S, PlayStation 4, Linux, Nintendo Switch 2, PC (Microsoft Windows), PlayStation 5, Mac, Wii U, Xbox One, Nintendo Switch","Platform, Adventure, Indie","Action, Fantasy","dark, sword, skill-based, 2d, metroidvania, insects, action-adventure, steam, achievements, steam trading cards, explorable world, atmospheric, giant insects, silent protagonist, crowdfunding - kickstarter, hand-drawn, crowdfunding, 2d platformer, boss fight, steam achievements, xbox controller support for pc, controller recommendation, crowd funded, shielded enemies, parrying, merchants, fast traveling, creature compendium, the game awards 2017, best debut indie game: nominee - 2017 (the game awards), the game awards - nominee, controller support, the game awards - best debut indie game - nominee, interconnected-world, armed bugs, money, shop keeper, sidescroller, available on - luna plus, available on - luna gog",https://www.youtube.com/watch?v=0lp2IG35Yho,226114,8400,5/2/2026,Console / Other,
My Hero Academia: All's Justice,Main Game,5/2/2026,Byking Inc.,Bandai Namco Entertainment,"Xbox Series X|S, PC (Microsoft Windows), PlayStation 5",Fighting,"Action, Science fiction",,https://www.youtube.com/watch?v=yXotYKenTSQ,22220,918,21/8/2025,Console / Other,
Wuthering Waves: For You Who Walk in Snow,Unknown,5/2/2026,Kuro Games,Kuro Games,"Android, PC (Microsoft Windows), iOS, PlayStation 5, Mac","Role-playing (RPG), Adventure","Action, Fantasy, Science fiction, Open world",,https://www.youtube.com/watch?v=6lpiSBvawB0,2670079,16783,23/1/2026,Console / Other,
Nioh 3,Main Game,6/2/2026,Team NINJA,Koei Tecmo Games,"PC (Microsoft Windows), PlayStation 5","Role-playing (RPG), Adventure",Action,,https://www.youtube.com/watch?v=rDyuGUlmTcY,908548,29,6/2/2026,PC Game (on Steam),
JDM: Japanese Drift Master,Main Game,6/2/2026,Gaming Factory,"Gaming Factory, 4Divinity","Xbox Series X|S, PC (Microsoft Windows), PlayStation 5","Racing, Simulator, Sport, Adventure, Arcade",,,https://www.youtube.com/watch?v=hWTgzh9k0b0,16926,425,8/1/2026,Console / Other,
Carmageddon: Rogue Shift,Main Game,6/2/2026,34BigThings,34BigThings,"Xbox Series X|S, Nintendo Switch 2, PC (Microsoft Windows), PlayStation 5",Racing,Action,,https://www.youtube.com/watch?v=1y65d1Flw0I,1605364,1213,5/2/2026,PC Game (on Steam),
Zenless Zone Zero: Update 2.6 - Encore for an Old Dream,Unknown,6/2/2026,"HoYoverse, Cognosphere","HoYoverse, Cognosphere","Xbox Series X|S, Android, PC (Microsoft Windows), iOS, PlayStation 5","Role-playing (RPG), Hack and slash/Beat 'em up, Adventure",Action,,https://www.youtube.com/watch?v=pMchTj9qzQY,175826,11928,30/1/2026,Console / Other,
Mote: Workshop,Main Game,6/2/2026,CraePlay,GGmuks Inc.,"PlayStation 5, PlayStation",Simulator,,walking simulator,No YouTube video found,,,,Console / Other,
Giant Chase,Main Game,6/2/2026,,Entity3 Limited,"PlayStation 5, Nintendo Switch","Adventure, Arcade",Action,,No YouTube video found,,,,Console / Other,
Sora: Winds of the Jungle,Main Game,6/2/2026,,EpiXR Games,"PlayStation 5, Nintendo Switch","Racing, Simulator, Adventure",,,No YouTube video found,,,,Console / Other,
Where Winds Meet: Spring's Bliss,Unknown,6/2/2026,Everstone Studio,NetEase Games,"Android, PC (Microsoft Windows), iOS, PlayStation 5",,,"martial arts, wuxia",https://www.youtube.com/watch?v=p4582Cijc0o,11038,1071,5/2/2026,Console / Other,
Dot Net,Main Game,6/2/2026,Acyntha,Acyntha,"PlayStation 4, PlayStation 5",,,,No YouTube video found,,,,Console / Other,
Kuky Adventure,Main Game,9/2/2026,Magnific Studios,"Magnific Studios, y-zo studio","Xbox Series X|S, PlayStation 4, PC (Microsoft Windows), PlayStation 5, Xbox One","Platform, Adventure",Action,,https://www.youtube.com/watch?v=N3636e6jcdI,106,3,8/2/2026,Console / Other,
Ultra Super Reflection Guide,Main Game,9/2/2026,,Xitilon,"PlayStation 4, PlayStation 5",Arcade,,,No YouTube video found,,,,Console / Other,
Ship's Cat,Main Game,9/2/2026,Caddy Computing,Caddy Computing,"PC (Microsoft Windows), PlayStation 5","Platform, Adventure, Indie","Action, Comedy",,https://www.youtube.com/watch?v=XZbFmmomvkg,801,11,8/12/2023,Console / Other,
Pixel Puzzles Japan Jigsaws,Main Game,9/2/2026,,,"PlayStation 4, PlayStation 5",Puzzle,,,No YouTube video found,,,,Console / Other,
Anime Uni 7: A Happy Valentine,Main Game,9/2/2026,BIG WAY,BIG WAY,"PlayStation 4, PlayStation 5",Puzzle,,,No YouTube video found,,,,Console / Other,
Crisol: Theater of Idols,Main Game,10/2/2026,Vermila Studios,Blumhouse Games,"Xbox Series X|S, PC (Microsoft Windows), PlayStation 5","Shooter, Adventure","Action, Horror, Survival, Mystery","dystopian, atmospheric",https://www.youtube.com/watch?v=ojViCqVTjsc,4069,118,10/2/2026,Console / Other,
Helldivers 2: Machinery of Oppression,Unknown,10/2/2026,Arrowhead Game Studios,Sony Interactive Entertainment,"Xbox Series X|S, PC (Microsoft Windows), PlayStation 5","Shooter, Tactical","Action, Science fiction",,https://www.youtube.com/watch?v=xzxwfxpPPS8,87480,3404,10/2/2026,Console / Other,
Romeo is a Dead Man,Main Game,11/2/2026,Grasshopper Manufacture,Grasshopper Manufacture,"Xbox Series X|S, PC (Microsoft Windows), PlayStation 5","Shooter, Hack and slash/Beat 'em up, Adventure","Action, Science fiction, Comedy, Mystery","bloody, surrealism, time travel, action-adventure, gore, surreal, dark humor, resurrection, time paradox, multiverse, stylish action, half-dead",https://www.youtube.com/watch?v=CHcb7_MEDKQ,30252,2312,9/2/2026,Console / Other,
No Man's Sky: Remnant,Unknown,11/2/2026,,,"Xbox Series X|S, PlayStation 4, Nintendo Switch 2, PC (Microsoft Windows), PlayStation 5, Mac, Xbox One, Nintendo Switch",,,,https://www.youtube.com/watch?v=IXWYo58yiz4,527765,36482,11/2/2026,Console / Other,
Cash Cleaner Simulator,Main Game,11/2/2026,Mind Control,Forklift Interactive,"Xbox Series X|S, PC (Microsoft Windows), PlayStation 5","Simulator, Indie",,,https://www.youtube.com/watch?v=EbP8pJA3BBM,21057,14,8/5/2025,Console / Other,
Dark Ties,Main Game,12/2/2026,Ryu Ga Gotoku Studios,Sega,"Xbox Series X|S, PlayStation 4, Nintendo Switch 2, PC (Microsoft Windows), PlayStation 5",,,,https://www.youtube.com/watch?v=za9rjoTdG_M,463013,19417,24/9/2025,Console / Other,
ChromaGun 2: Dye Hard,Main Game,12/2/2026,Pixel Maniacs,PM Studios,"Xbox Series X|S, Nintendo Switch 2, PC (Microsoft Windows), PlayStation 5","Shooter, Puzzle, Strategy, Adventure, Indie","Action, Science fiction, Comedy","action-adventure, steam, steam achievements, steam cloud",https://www.youtube.com/watch?v=f2Hey9REICI,551,13,12/2/2026,Console / Other,
Ride 6,Main Game,12/2/2026,Milestone,Milestone,"Xbox Series X|S, PC (Microsoft Windows), PlayStation 5","Racing, Simulator, Sport",,"racing sim, motorsports",https://www.youtube.com/watch?v=sqEVNUNA9Ng,50078,192,12/2/2026,Console / Other,
Heart of the Forest,Main Game,12/2/2026,"Trapped Predator, Wales Interactive",Wales Interactive,"Xbox Series X|S, PlayStation 4, Android, PC (Microsoft Windows), iOS, PlayStation 5, Mac, Xbox One, Nintendo Switch","Adventure, Indie, Visual Novel",Horror,"steam achievements, fmv",https://www.youtube.com/watch?v=LVfKbhzbUmA,12015,109,30/9/2025,Console / Other,
Pure Pool Pro,Main Game,12/2/2026,Rockwater Games,Ripstone,"Xbox Series X|S, PC (Microsoft Windows), PlayStation 5","Simulator, Sport, Strategy, Indie",,"pool, billiards, relaxing, billiards game, jazz, cosy",https://www.youtube.com/watch?v=oCLc4qrR1u0,5186,100,5/2/2026,Console / Other,
Yakuza Kiwami 3 & Dark Ties: Deluxe Edition,Main Game,12/2/2026,Ryu Ga Gotoku Studios,Sega,"Xbox Series X|S, PlayStation 4, Nintendo Switch 2, PC (Microsoft Windows), PlayStation 5","Role-playing (RPG), Adventure",Action,,No YouTube video found,,,,Console / Other,
God of War Sons of Sparta,Main Game,12/2/2026,Mega Cat Studios,Sony Interactive Entertainment,PlayStation 5,"Platform, Adventure","Action, Fantasy","greek mythology, prequel, metroidvania, kratos",https://www.youtube.com/watch?v=eFhOo6NTt70,1685145,63385,12/2/2026,Console / Other,
Disciples: Domination,Main Game,12/2/2026,Artefacts Studio,Kalypso Media,"Xbox Series X|S, PC (Microsoft Windows), PlayStation 5, Mac","Role-playing (RPG), Strategy",Fantasy,,https://www.youtube.com/watch?v=qibYooMRqsg,2671,53,12/2/2026,Console / Other,
Centipede Gun,Main Game,12/2/2026,Mateusk2m,QUByte Interactive,"Xbox Series X|S, PlayStation 4, PC (Microsoft Windows), PlayStation 5, Xbox One, Nintendo Switch","Shooter, Strategy, Indie, Arcade",Action,roguelike,https://www.youtube.com/watch?v=TsLwt2RM19Q,674,28,22/1/2026,Console / Other,
High on Life 2,Main Game,13/2/2026,Squanch Games,Squanch Games,"Xbox Series X|S, Nintendo Switch 2, PC (Microsoft Windows), PlayStation 5","Shooter, Adventure","Action, Science fiction, Comedy",,https://www.youtube.com/watch?v=PdMX5_snGGQ,39532,1251,13/2/2026,Console / Other,
Reanimal,Main Game,13/2/2026,Tarsier Studios,THQ Nordic,"Xbox Series X|S, Nintendo Switch 2, PC (Microsoft Windows), PlayStation 5","Puzzle, Adventure","Action, Horror",nextfest october 2025,https://www.youtube.com/watch?v=5_EfcYKD65g,2082804,760,13/2/2026,PC Game (on Steam),
Reanimal: Collector's Edition,Main Game,13/2/2026,Tarsier Studios,THQ Nordic,"Xbox Series X|S, Nintendo Switch 2, PC (Microsoft Windows), PlayStation 5",Adventure,Horror,,https://www.youtube.com/watch?v=17WtFn0P2eM,34966,1185,1/8/2025,Console / Other,
Reanimal: Digital Deluxe Edition,Main Game,13/2/2026,Tarsier Studios,THQ Nordic,"Xbox Series X|S, Nintendo Switch 2, PC (Microsoft Windows), PlayStation 5",Adventure,Horror,,No YouTube video found,,,,Console / Other,
Reanimal: Deluxe Edition,Main Game,13/2/2026,Tarsier Studios,THQ Nordic,"Xbox Series X|S, Nintendo Switch 2, PlayStation 5",Adventure,Horror,,No YouTube video found,,,,Console / Other,
Rune Factory: Guardians of Azuma,Main Game,13/2/2026,Marvelous,"Marvelous, Marvelous Europe Ltd.","Nintendo Switch 2, PC (Microsoft Windows), PlayStation 5, Nintendo Switch","Role-playing (RPG), Simulator, Adventure","Action, Fantasy","magic, jrpg, dragon, story rich",https://www.youtube.com/watch?v=oVjcryq8OvQ,49366,1492,8/12/2025,Console / Other,
Honkai: Star Rail - No Aha At Full Moon,Unknown,13/2/2026,HoYoverse,HoYoverse,"Android, PC (Microsoft Windows), iOS, PlayStation 5","Role-playing (RPG), Turn-based strategy (TBS)","Action, Fantasy",,https://www.youtube.com/watch?v=2hH0hILcWPs,1922876,27597,6/2/2026,Console / Other,
Kingdom Come: Deliverance,Main Game,13/2/2026,Warhorse Studios,"Deep Silver, Warhorse Studios","Xbox Series X|S, PlayStation 4, PC (Microsoft Windows), PlayStation 5, Xbox One, Nintendo Switch","Role-playing (RPG), Adventure","Action, Historical, Stealth, Open world","knights, medieval, steam trading cards, melee combat, non-linear, crowdfunding - kickstarter, day/night cycle, inventory management, crowdfunding, steam achievements, steam cloud, human, xbox one x enhanced, real-time combat, crowd funded, rpg elements, mercenary, realism, steam families",https://www.youtube.com/watch?v=H_gLXjKFYQg,322952,22012,13/2/2026,Console / Other,
Supreme Strategic Battles 2,Main Game,26/2/2026,SystemSoft Beta,SystemSoft Beta,"Nintendo Switch 2, PC (Microsoft Windows), PlayStation 5, Nintendo Switch","Simulator, Strategy",,,https://www.youtube.com/watch?v=vPcZjKVzMho,73592,611,19/9/2025,Console / Other,
Dark Dungeon Mind Mess,Main Game,15/1/2026,,,"Xbox Series X|S, PC (Microsoft Windows), Xbox One",Puzzle,,,No YouTube video found,,,,Non-Steam PC Game,
"God bless, or Goddess",Main Game,15/1/2026,蒸汽满满工作室,蒸汽满满工作室,"Xbox Series X|S, PlayStation 4, PC (Microsoft Windows), PlayStation 5, Xbox One, Nintendo Switch","Role-playing (RPG), Simulator, Strategy, Adventure, Indie, Visual Novel","Fantasy, Historical, Romance",,No YouTube video found,,,,Console / Other,
Song of the Prairie,Main Game,16/1/2026,The Droplet Studio,"AOE Plus, YIJIA NETWORK TECHNOLOGY","Xbox Series X|S, PC (Microsoft Windows), PlayStation 5","Role-playing (RPG), Simulator, Adventure",,"3d, farming, farming simulator",https://www.youtube.com/watch?v=SlxHc3GuxLA,832,13,3/4/2025,Console / Other,
Pathologic 3,Main Game,23/1/2026,Ice-Pick Lodge,HypeTrain Digital,"Xbox Series X|S, PC (Microsoft Windows), PlayStation 5","Role-playing (RPG), Simulator, Adventure, Indie","Horror, Thriller, Survival, Drama, Open world, Mystery","psychological horror, dystopian, simulation, surreal, immersive sim, nextfest october 2025",https://www.youtube.com/watch?v=eTwFOpkncsI,65300,2364,9/1/2026,Console / Other,
The Monty Mole Collection,Main Game,23/1/2026,,,"Xbox Series X|S, PC (Microsoft Windows), Nintendo Switch","Platform, Adventure, Arcade",Action,,No YouTube video found,,,,Non-Steam PC Game,
"Rightfully, Beary Arms",Main Game,27/1/2026,Daylight Basement Studio,Daylight Basement Studio,"Xbox Series X|S, PC (Microsoft Windows), Xbox One","Shooter, Adventure, Indie","Action, Science fiction","pve, cute, pixel graphics, roguelite",https://www.youtube.com/watch?v=43djn8PfyAc,441,8,27/1/2026,PC Game (on Steam),
Our Adventurer Guild,Main Game,27/1/2026,GreenGuy,GreenGuy,"Xbox Series X|S, PC (Microsoft Windows), Xbox One","Role-playing (RPG), Strategy, Turn-based strategy (TBS), Tactical, Indie",Fantasy,"anime, party-based",https://www.youtube.com/watch?v=BmjGUS0-p-Y,353,6,27/1/2026,Console / Other,
Empire in Decay,Main Game,1/2/2026,Siesta Games,Siesta Games,"Xbox Series X|S, PC (Microsoft Windows), Nintendo Switch","Role-playing (RPG), Strategy, Turn-based strategy (TBS), Tactical, Indie",Action,"chess, roguelike deckbuilder",https://www.youtube.com/watch?v=Sw0svzOTGko,55,4,5/10/2025,Console / Other,
Mini Golf Quest,Main Game,5/2/2026,Gametry,Gametry,"Xbox Series X|S, PlayStation 4, PlayStation 5, Xbox One, Nintendo Switch","Sport, Arcade",,,No YouTube video found,,,,Console / Other,
World's End Club,Main Game,9/2/2026,"Too Kyo Games, IzanagiGames",NIS America,"Xbox Series X|S, PC (Microsoft Windows), iOS, PlayStation 5, Xbox One, Nintendo Switch","Platform, Role-playing (RPG), Adventure",Action,previously on - apple arcade,https://www.youtube.com/watch?v=aEvq3ZthCKg,138884,4284,18/2/2021,Console / Other,
Relooted,Main Game,10/2/2026,Nyamakop,Nyamakop,"Xbox Series X|S, PC (Microsoft Windows)","Platform, Puzzle, Adventure",Action,,https://www.youtube.com/watch?v=Bf1i1-9_71Q,1012,0,10/2/2026,Console / Other,
Starsand Island,Main Game,11/2/2026,Seed Lab,Seed Lab,"Xbox Series X|S, Nintendo Switch 2, PC (Microsoft Windows), PlayStation 5, Mac","Role-playing (RPG), Simulator, Indie",,"life simulation, farming simulator",https://www.youtube.com/watch?v=X0-YSWoUkNU,209230,47,4/12/2025,Console / Other,
Hidden Objects: Sleeping Beauty,Main Game,11/2/2026,Crisp App Studio LLC,Crisp App Studio LLC,"Xbox Series X|S, PC (Microsoft Windows), Mac, Xbox One","Point-and-click, Adventure, Indie",,"hidden object, based on - fairy tale, sleeping beauty",No YouTube video found,,,,Console / Other,
Roadside Research,Main Game,12/2/2026,Cybernetic Walrus,Oro Interactive,"Xbox Series X|S, PC (Microsoft Windows)",Simulator,"Science fiction, Comedy","alien, supermarket simulator, gas station",https://www.youtube.com/watch?v=Yy3A4oxvKKg,21623,479,20/11/2025,Console / Other,
Motel Business Simulator,Main Game,15/1/2026,Nostra Games,Nostra Games,"PlayStation 4, PlayStation 5, Nintendo Switch","Puzzle, Simulator, Strategy, Indie, Arcade",Business,"hotel management, business simulation, hotel",https://www.youtube.com/watch?v=MgeWvYBvqg8,1222,11,19/9/2025,Console / Other,
